id,ticket_id,priority,status,category,subject,description,created_date,resolved_date,assigned_to,created_at
1,97bb2953,Low,Resolved,Hardware,Software install request,Hardware - Software install request. Priority: Low.,3/25/2024,,Carol,2024-03-25T01:08:00
2,fe47db58,Critical,In Progress,Software,Computer slow,Critical priority: Computer slow (Software).,4/1/2024,,Grace,2024-04-01T19:05:00
3,88e20022,Medium,Resolved,Hardware,VPN problem,Hardware - VPN problem. Priority: Medium.,1/22/2024,1/30/2024,Alice,2024-01-22T17:30:00
4,456d5d2a,Medium,Closed,Security,Login issue,Medium priority: Login issue (Security).,7/11/2024,7/15/2024,Bob,2024-07-11T19:41:00
5,7b796e92,Low,Resolved,Security,Computer slow,Security issue: Computer slow — see ticket 7b796e92.,4/4/2024,4/8/2024,Frank,2024-04-04T22:58:00
6,b0b695be,Low,Closed,Access,Computer slow,Computer slow reported; Carol handling; Low.,3/2/2024,,Carol,2024-03-02T05:27:00
7,ada720c7,Low,Open,Security,Software install request,Software install request — Security ticket assigned to Alice.,3/16/2024,3/22/2024,Alice,2024-03-16T21:06:00
8,7df294ef,Critical,Resolved,Software,Login issue,Alice to resolve Login issue in Software.,3/19/2024,3/24/2024,Alice,2024-03-19T06:14:00
9,5785b1a6,Medium,Open,Access,Login issue,David to resolve Login issue in Access.,9/19/2024,9/28/2024,David,2024-09-19T13:06:00
10,22b8630f,High,Closed,Software,VPN problem,Software - VPN problem. Priority: High.,5/25/2024,5/25/2024,Frank,2024-05-25T07:59:00
11,918e9ed0,Medium,In Progress,Hardware,Computer slow,Computer slow reported; Grace handling; Medium.,6/27/2024,7/1/2024,Grace,2024-06-27T00:59:00
12,b86ff979,Medium,Closed,Security,VPN problem,Security issue: VPN problem — see ticket b86ff979.,1/3/2024,1/7/2024,Carol,2024-01-03T15:33:00
13,f751ebe2,Low,Closed,Access,Email not working,Email not working (Access) — ticket f751ebe2.,1/21/2024,1/24/2024,David,2024-01-21T08:53:00
14,9262a32b,Critical,Closed,Network,Login issue,Network - Login issue. Priority: Critical.,8/6/2024,,Grace,2024-08-06T04:22:00
15,6f37ff6a,High,In Progress,Network,Email not working,Email not working reported; Frank handling; High.,7/10/2024,7/19/2024,Frank,2024-07-10T18:20:00
16,b4eb7791,High,Closed,Network,VPN problem,David to resolve VPN problem in Network.,9/23/2024,9/26/2024,David,2024-09-23T06:31:00
17,68851050,Medium,In Progress,Network,VPN problem,Help Grace with VPN problem (Network).,9/28/2024,10/7/2024,Grace,2024-09-28T01:03:00
18,1430b708,Critical,Resolved,Hardware,VPN problem,Hardware - VPN problem. Priority: Critical.,9/13/2024,9/17/2024,Carol,2024-09-13T00:12:00
19,32ab68d6,Low,In Progress,Software,Software install request,Software install request (Software) — ticket 32ab68d6.,10/22/2024,,Frank,2024-10-22T06:04:00
20,37bd6bb7,High,In Progress,Hardware,VPN problem,VPN problem; Hardware; assigned Bob.,10/11/2024,,Bob,2024-10-11T19:47:00
21,9e62dd05,High,Closed,Network,VPN problem,VPN problem — Network ticket assigned to Alice.,9/5/2024,9/13/2024,Alice,2024-09-05T21:08:00
22,9871f4c5,Critical,Open,Access,VPN problem,Access issue: VPN problem — see ticket 9871f4c5.,7/22/2024,,Frank,2024-07-22T11:57:00
23,e5ac809d,Medium,Open,Network,VPN problem,Medium priority: VPN problem (Network).,1/10/2024,,Grace,2024-01-10T21:15:00
24,046829f1,High,Resolved,Network,VPN problem,VPN problem (Network) — ticket 046829f1.,3/10/2024,,Grace,2024-03-10T13:43:00
25,75387a85,Critical,In Progress,Software,Software install request,Software - Software install request. Priority: Critical.,6/24/2024,6/26/2024,David,2024-06-24T15:40:00
26,551f27f2,Low,In Progress,Hardware,VPN problem,Hardware issue: VPN problem — see ticket 551f27f2.,3/27/2024,,Eve,2024-03-27T16:30:00
27,8e775ebb,Medium,Open,Security,Software install request,Software install request reported; Carol handling; Medium.,7/16/2024,7/23/2024,Carol,2024-07-16T14:01:00
28,b37762bd,Low,In Progress,Network,Email not working,Alice to resolve Email not working in Network.,2/24/2024,3/4/2024,Alice,2024-02-24T16:42:00
29,4463245d,High,In Progress,Security,Email not working,Email not working; Security; assigned Carol.,8/4/2024,8/9/2024,Carol,2024-08-04T21:26:00
30,bd7958f0,Medium,In Progress,Access,Email not working,Email not working reported; Carol handling; Medium.,5/24/2024,5/25/2024,Carol,2024-05-24T10:32:00
31,68667770,Medium,Closed,Software,Software install request,Eve to resolve Software install request in Software.,10/5/2024,10/16/2024,Eve,2024-10-05T20:57:00
32,ffcc1724,Low,Resolved,Software,Computer slow,Software - Computer slow. Priority: Low.,1/5/2024,,Frank,2024-01-05T19:55:00
33,b3921778,Low,Open,Software,Email not working,Software - Email not working. Priority: Low.,5/28/2024,6/2/2024,Frank,2024-05-28T20:15:00
34,6c31330b,Medium,Open,Security,Email not working,Email not working (Security) — ticket 6c31330b.,8/3/2024,8/4/2024,Alice,2024-08-03T02:16:00
35,85acd9f2,Medium,Closed,Security,Email not working,Email not working (Security) — ticket 85acd9f2.,2/25/2024,,Alice,2024-02-25T06:04:00
36,00a7d32a,High,In Progress,Security,Login issue,Carol to resolve Login issue in Security.,10/18/2024,,Carol,2024-10-18T11:39:00
37,4b591d36,Critical,In Progress,Hardware,Login issue,Hardware - Login issue. Priority: Critical.,5/15/2024,5/16/2024,Carol,2024-05-15T14:15:00
38,773524f2,High,Open,Hardware,Software install request,High - Software install request. Assigned: Bob.,3/30/2024,3/31/2024,Bob,2024-03-30T16:01:00
39,32c10da2,Medium,Open,Software,VPN problem,Alice to resolve VPN problem in Software.,5/2/2024,,Alice,2024-05-02T21:02:00
40,44e4b1c9,Low,Closed,Security,Computer slow,Computer slow; Security; assigned Bob.,6/7/2024,6/16/2024,Bob,2024-06-07T20:07:00
41,6e9afb4b,Low,Resolved,Network,VPN problem,VPN problem; Network; assigned Eve.,10/23/2024,11/1/2024,Eve,2024-10-23T03:24:00
42,a148bb5b,Low,Resolved,Hardware,Login issue,Low priority: Login issue (Hardware).,6/24/2024,6/27/2024,David,2024-06-24T09:55:00
43,45a0fe86,Medium,Open,Network,Computer slow,Medium priority: Computer slow (Network).,1/14/2024,,David,2024-01-14T10:40:00
44,7cd2672e,Low,Closed,Access,Login issue,Access - Login issue. Priority: Low.,1/19/2024,,David,2024-01-19T18:53:00
45,49fbdac2,Critical,Closed,Security,Login issue,Login issue (Security) — ticket 49fbdac2.,8/4/2024,8/7/2024,Alice,2024-08-04T03:57:00
46,9d76bf6d,Low,Closed,Software,Computer slow,Bob to resolve Computer slow in Software.,5/10/2024,,Bob,2024-05-10T16:08:00
47,18e2f072,Medium,Closed,Security,Software install request,Help Alice with Software install request (Security).,8/20/2024,8/31/2024,Alice,2024-08-20T10:15:00
48,08bad74c,Medium,Resolved,Access,Computer slow,Computer slow (Access) — ticket 08bad74c.,6/19/2024,,Alice,2024-06-19T03:06:00
49,5de4f447,Critical,Closed,Access,Login issue,Access issue: Login issue — see ticket 5de4f447.,10/6/2024,10/14/2024,Grace,2024-10-06T14:06:00
50,48ea9d46,Medium,Open,Access,Login issue,Login issue — Access ticket assigned to Carol.,3/20/2024,3/26/2024,Carol,2024-03-20T04:26:00
51,9054653f,High,In Progress,Network,Email not working,Email not working; Network; assigned Grace.,7/26/2024,8/4/2024,Grace,2024-07-26T01:30:00
52,0d01a5c5,Low,Open,Network,Login issue,Network issue: Login issue — see ticket 0d01a5c5.,10/14/2024,10/14/2024,Bob,2024-10-14T11:44:00
53,01fb07ca,High,In Progress,Access,Software install request,Access - Software install request. Priority: High.,7/14/2024,7/16/2024,Frank,2024-07-14T02:20:00
54,84668aa2,Medium,Open,Security,Email not working,Email not working — Security ticket assigned to Alice.,1/3/2024,1/8/2024,Alice,2024-01-03T02:39:00
55,d3f1d2d4,High,Resolved,Hardware,Email not working,High priority: Email not working (Hardware).,4/26/2024,,Alice,2024-04-26T08:32:00
56,b0eb9e2b,Critical,Closed,Hardware,Software install request,Software install request; Hardware; assigned Eve.,6/30/2024,7/2/2024,Eve,2024-06-30T06:03:00
57,a02b0dfb,Medium,In Progress,Software,Email not working,Help Carol with Email not working (Software).,4/29/2024,5/7/2024,Carol,2024-04-29T18:21:00
58,56a0a0b6,Low,Closed,Hardware,VPN problem,Low - VPN problem. Assigned: David.,7/23/2024,7/26/2024,David,2024-07-23T09:27:00
59,65de4a09,Low,Closed,Security,Software install request,Low - Software install request. Assigned: Eve.,1/30/2024,,Eve,2024-01-30T19:31:00
60,17d5d62d,Low,Open,Security,Email not working,Low priority: Email not working (Security).,5/12/2024,5/15/2024,Frank,2024-05-12T18:17:00
61,459931b3,Low,In Progress,Network,Computer slow,Help Bob with Computer slow (Network).,1/18/2024,,Bob,2024-01-18T11:35:00
62,4d4188d6,Critical,Open,Software,Computer slow,Computer slow reported; Frank handling; Critical.,5/25/2024,6/1/2024,Frank,2024-05-25T22:10:00
63,e5925e57,Critical,Closed,Access,VPN problem,Frank to resolve VPN problem in Access.,10/27/2024,,Frank,2024-10-27T23:10:00
64,57b125df,Low,Open,Access,Email not working,Email not working; Access; assigned Eve.,1/23/2024,1/30/2024,Eve,2024-01-23T22:14:00
65,f0cae446,High,Open,Access,Email not working,Email not working reported; David handling; High.,6/11/2024,6/15/2024,David,2024-06-11T22:45:00
66,9c0af6f6,High,Open,Network,Login issue,Login issue (Network) — ticket 9c0af6f6.,4/24/2024,5/2/2024,Frank,2024-04-24T17:46:00
67,2837982,Low,Closed,Network,Login issue,Network - Login issue. Priority: Low.,4/23/2024,4/28/2024,David,2024-04-23T22:18:00
68,357a8ad0,Critical,Closed,Hardware,Email not working,Critical priority: Email not working (Hardware).,10/1/2024,10/11/2024,Carol,2024-10-01T08:08:00
69,7f843250,High,Open,Software,Software install request,Software install request — Software ticket assigned to David.,3/12/2024,3/20/2024,David,2024-03-12T15:06:00
70,62f4e664,Critical,Closed,Security,VPN problem,Critical priority: VPN problem (Security).,6/10/2024,6/19/2024,Alice,2024-06-10T14:44:00
71,61e61c6d,Low,Closed,Security,VPN problem,Security issue: VPN problem — see ticket 61e61c6d.,4/12/2024,4/13/2024,Carol,2024-04-12T22:25:00
72,5dd3a92d,High,Open,Security,VPN problem,Security - VPN problem. Priority: High.,2/15/2024,2/15/2024,Alice,2024-02-15T00:29:00
73,76b8fa16,Critical,Open,Software,Email not working,Software - Email not working. Priority: Critical.,1/22/2024,1/28/2024,Bob,2024-01-22T19:58:00
74,8efdc245,High,Closed,Network,Email not working,Email not working; Network; assigned Bob.,1/28/2024,,Bob,2024-01-28T10:36:00
75,cdbb5ca8,High,Closed,Hardware,VPN problem,VPN problem reported; Frank handling; High.,3/14/2024,3/15/2024,Frank,2024-03-14T13:58:00
76,6d61ab30,Medium,Closed,Software,VPN problem,VPN problem (Software) — ticket 6d61ab30.,9/14/2024,9/19/2024,Carol,2024-09-14T03:59:00
77,7bfb020f,Critical,Resolved,Software,VPN problem,VPN problem — Software ticket assigned to Frank.,5/30/2024,6/5/2024,Frank,2024-05-30T01:00:00
78,5cebf090,High,Resolved,Access,Email not working,Email not working; Access; assigned Frank.,4/10/2024,,Frank,2024-04-10T11:19:00
79,554ad717,Critical,Resolved,Software,Email not working,Email not working; Software; assigned Grace.,9/29/2024,10/2/2024,Grace,2024-09-29T03:37:00
80,7e8ef6fe,Medium,Resolved,Access,Computer slow,Computer slow; Access; assigned David.,2/5/2024,2/10/2024,David,2024-02-05T14:15:00
81,aa185bfb,Medium,In Progress,Access,Email not working,Email not working — Access ticket assigned to Grace.,1/3/2024,1/6/2024,Grace,2024-01-03T09:36:00
82,21f1ee65,Critical,In Progress,Network,Login issue,Login issue — Network ticket assigned to Eve.,5/15/2024,5/20/2024,Eve,2024-05-15T10:35:00
83,f7c723f7,Medium,Open,Security,Software install request,Software install request (Security) — ticket f7c723f7.,5/22/2024,5/28/2024,David,2024-05-22T06:17:00
84,5bd18df9,Low,Open,Network,Software install request,Software install request reported; Carol handling; Low.,1/17/2024,1/23/2024,Carol,2024-01-17T01:31:00
85,bf953154,Medium,Closed,Access,VPN problem,VPN problem — Access ticket assigned to Alice.,10/26/2024,11/5/2024,Alice,2024-10-26T22:32:00
86,a49ce5cb,Low,Closed,Hardware,Computer slow,Computer slow; Hardware; assigned Bob.,1/18/2024,,Bob,2024-01-18T03:26:00
87,260cd223,Critical,Closed,Access,VPN problem,Access issue: VPN problem — see ticket 260cd223.,1/30/2024,2/7/2024,Alice,2024-01-30T04:10:00
88,c4b5d839,Medium,Resolved,Network,Software install request,Medium priority: Software install request (Network).,10/15/2024,10/23/2024,Alice,2024-10-15T02:16:00
89,b105df00,Critical,In Progress,Security,VPN problem,VPN problem reported; David handling; Critical.,9/28/2024,10/5/2024,David,2024-09-28T22:53:00
90,934b0138,Critical,Open,Access,Computer slow,Critical priority: Computer slow (Access).,2/22/2024,2/28/2024,David,2024-02-22T23:49:00
91,30ac0ac4,Medium,Resolved,Hardware,Computer slow,Help David with Computer slow (Hardware).,1/10/2024,1/16/2024,David,2024-01-10T18:21:00
92,cf22664a,High,Open,Security,Computer slow,Security - Computer slow. Priority: High.,4/14/2024,4/19/2024,Grace,2024-04-14T09:07:00
93,562b5742,High,In Progress,Software,Login issue,Login issue — Software ticket assigned to Alice.,9/9/2024,9/18/2024,Alice,2024-09-09T10:18:00
94,abd8dc75,Medium,In Progress,Access,Email not working,Access issue: Email not working — see ticket abd8dc75.,3/25/2024,4/1/2024,David,2024-03-25T18:55:00
95,9a6d059c,High,Open,Access,Software install request,Alice to resolve Software install request in Access.,5/20/2024,5/22/2024,Alice,2024-05-20T20:28:00
96,9734229b,Low,In Progress,Hardware,VPN problem,Hardware - VPN problem. Priority: Low.,2/8/2024,2/16/2024,David,2024-02-08T02:38:00
97,8388f4f2,Critical,In Progress,Software,Login issue,Software issue: Login issue — see ticket 8388f4f2.,7/5/2024,7/7/2024,Frank,2024-07-05T20:23:00
98,2af46ad6,Low,Open,Software,Login issue,Software issue: Login issue — see ticket 2af46ad6.,8/24/2024,9/2/2024,Alice,2024-08-24T15:56:00
99,500252f2,Medium,Closed,Access,Software install request,Software install request reported; David handling; Medium.,7/22/2024,7/22/2024,David,2024-07-22T14:57:00
100,ca734f9e,Medium,In Progress,Access,VPN problem,VPN problem reported; Frank handling; Medium.,8/22/2024,8/28/2024,Frank,2024-08-22T00:14:00
101,a9ac4238,Critical,Closed,Network,Login issue,Help Grace with Login issue (Network).,9/26/2024,10/4/2024,Grace,2024-09-26T11:10:00
102,abef17cb,High,Open,Security,VPN problem,Alice to resolve VPN problem in Security.,1/16/2024,1/18/2024,Alice,2024-01-16T05:55:00
103,5d8b345a,High,In Progress,Security,Computer slow,Computer slow reported; Eve handling; High.,6/20/2024,6/22/2024,Eve,2024-06-20T16:01:00
104,d8b04736,Medium,In Progress,Network,VPN problem,VPN problem (Network) — ticket d8b04736.,2/22/2024,,Frank,2024-02-22T14:53:00
105,626835cb,Low,Resolved,Access,Login issue,Login issue (Access) — ticket 626835cb.,7/25/2024,,Bob,2024-07-25T13:04:00
106,217b010e,Low,Closed,Security,Login issue,Login issue (Security) — ticket 217b010e.,6/29/2024,,Alice,2024-06-29T11:46:00
107,7b1f252a,Critical,In Progress,Software,Login issue,Login issue; Software; assigned Carol.,3/10/2024,3/19/2024,Carol,2024-03-10T06:53:00
108,0e4c8b12,High,Closed,Software,Software install request,Software issue: Software install request — see ticket 0e4c8b12.,7/8/2024,7/15/2024,Alice,2024-07-08T20:17:00
109,7c3ee184,Critical,Closed,Access,Email not working,Email not working; Access; assigned Bob.,9/17/2024,,Bob,2024-09-17T15:56:00
110,0b157abc,Medium,In Progress,Software,Computer slow,Computer slow; Software; assigned Bob.,5/18/2024,5/26/2024,Bob,2024-05-18T00:57:00
111,1465447f,Medium,Open,Hardware,Software install request,Hardware issue: Software install request — see ticket 1465447f.,4/21/2024,4/30/2024,Alice,2024-04-21T08:23:00
112,071ab626,Medium,Open,Hardware,VPN problem,Help Frank with VPN problem (Hardware).,7/23/2024,7/26/2024,Frank,2024-07-23T08:32:00
113,a5ad79a8,Low,In Progress,Hardware,Computer slow,Computer slow; Hardware; assigned Frank.,3/13/2024,3/14/2024,Frank,2024-03-13T13:34:00
114,0806444a,High,Resolved,Access,VPN problem,High - VPN problem. Assigned: Frank.,4/2/2024,4/4/2024,Frank,2024-04-02T12:54:00
115,074a0c3a,Medium,Resolved,Software,Login issue,Medium - Login issue. Assigned: David.,4/28/2024,5/1/2024,David,2024-04-28T03:55:00
116,73b0e509,Critical,Resolved,Hardware,VPN problem,VPN problem (Hardware) — ticket 73b0e509.,3/1/2024,3/1/2024,Bob,2024-03-01T08:36:00
117,fdfd2572,Low,In Progress,Network,Email not working,Email not working; Network; assigned Frank.,4/6/2024,4/7/2024,Frank,2024-04-06T08:45:00
118,f9a35e66,Critical,Closed,Hardware,Software install request,Software install request; Hardware; assigned David.,10/27/2024,10/29/2024,David,2024-10-27T06:41:00
119,96e8b8bf,Critical,Closed,Security,VPN problem,Critical - VPN problem. Assigned: Bob.,10/11/2024,10/12/2024,Bob,2024-10-11T23:06:00
120,8628c06b,Low,Closed,Software,Email not working,Low - Email not working. Assigned: Eve.,8/3/2024,8/12/2024,Eve,2024-08-03T21:28:00
121,bd21ff21,Medium,Open,Hardware,VPN problem,Grace to resolve VPN problem in Hardware.,10/9/2024,10/12/2024,Grace,2024-10-09T05:25:00
122,de4fc0b1,Low,Closed,Hardware,Login issue,Low - Login issue. Assigned: Alice.,1/17/2024,,Alice,2024-01-17T02:10:00
123,2422b6ce,Critical,Resolved,Network,Computer slow,Network - Computer slow. Priority: Critical.,8/2/2024,8/12/2024,Frank,2024-08-02T14:49:00
124,a8d42c83,Critical,Closed,Hardware,Login issue,Help Grace with Login issue (Hardware).,2/2/2024,2/6/2024,Grace,2024-02-02T11:51:00
125,d8dadf47,Low,Closed,Hardware,Software install request,Hardware issue: Software install request — see ticket d8dadf47.,5/16/2024,5/18/2024,Alice,2024-05-16T10:30:00
126,41edaad6,Critical,Closed,Software,Software install request,Software install request; Software; assigned David.,7/9/2024,,David,2024-07-09T03:40:00
127,f0e619cc,Medium,Open,Security,Email not working,Email not working reported; Frank handling; Medium.,3/19/2024,3/26/2024,Frank,2024-03-19T05:40:00
128,bb557fdf,Critical,Resolved,Network,Login issue,Critical priority: Login issue (Network).,4/1/2024,4/7/2024,David,2024-04-01T17:02:00
129,56fbdf76,High,In Progress,Access,VPN problem,VPN problem — Access ticket assigned to David.,5/23/2024,5/28/2024,David,2024-05-23T23:26:00
130,e667f6ae,Medium,Open,Security,Login issue,Login issue; Security; assigned Grace.,2/7/2024,2/9/2024,Grace,2024-02-07T19:00:00
131,9a3b5682,High,Open,Access,Login issue,Help David with Login issue (Access).,3/17/2024,3/22/2024,David,2024-03-17T07:06:00
132,34f0711d,Low,Open,Access,Software install request,Software install request — Access ticket assigned to Bob.,8/4/2024,,Bob,2024-08-04T05:43:00
133,d7a168ca,Critical,Open,Access,Software install request,Help David with Software install request (Access).,10/22/2024,11/2/2024,David,2024-10-22T22:27:00
134,6c8db74e,High,Closed,Security,Software install request,Help Alice with Software install request (Security).,9/17/2024,9/27/2024,Alice,2024-09-17T21:17:00
135,415c5363,Medium,Resolved,Security,Computer slow,Computer slow (Security) — ticket 415c5363.,7/25/2024,8/2/2024,Alice,2024-07-25T14:01:00
136,14f07fbb,Critical,In Progress,Security,Email not working,Security - Email not working. Priority: Critical.,2/25/2024,3/1/2024,Eve,2024-02-25T10:23:00
137,89c4c050,Critical,Closed,Hardware,Computer slow,Eve to resolve Computer slow in Hardware.,8/12/2024,8/19/2024,Eve,2024-08-12T15:09:00
138,f439c774,Medium,Resolved,Security,VPN problem,Help Frank with VPN problem (Security).,4/17/2024,4/28/2024,Frank,2024-04-17T23:50:00
139,0ad699f1,Medium,Resolved,Hardware,Software install request,Help Carol with Software install request (Hardware).,4/16/2024,4/19/2024,Carol,2024-04-16T11:31:00
140,f6d06d14,Medium,Closed,Security,Login issue,Security issue: Login issue — see ticket f6d06d14.,10/5/2024,10/12/2024,Frank,2024-10-05T11:42:00
141,58ca60b0,Medium,In Progress,Security,VPN problem,VPN problem (Security) — ticket 58ca60b0.,6/26/2024,7/4/2024,Grace,2024-06-26T00:49:00
142,31b1cabb,Critical,Closed,Security,Computer slow,Computer slow; Security; assigned Alice.,10/4/2024,10/8/2024,Alice,2024-10-04T04:56:00
143,281ab612,Low,In Progress,Access,VPN problem,VPN problem (Access) — ticket 281ab612.,4/1/2024,4/2/2024,Frank,2024-04-01T04:51:00
144,88852db9,High,Open,Access,Software install request,Software install request reported; Grace handling; High.,6/27/2024,,Grace,2024-06-27T18:12:00
145,067a99d4,Critical,In Progress,Network,VPN problem,Network issue: VPN problem — see ticket 067a99d4.,9/21/2024,9/29/2024,David,2024-09-21T14:31:00
146,a7f4d95a,Critical,Closed,Hardware,Software install request,Hardware issue: Software install request — see ticket a7f4d95a.,3/19/2024,,Frank,2024-03-19T14:43:00
147,0ee1ce05,High,Closed,Software,Software install request,High priority: Software install request (Software).,4/28/2024,5/4/2024,Eve,2024-04-28T04:25:00
148,e623a570,High,Closed,Access,Login issue,Bob to resolve Login issue in Access.,10/3/2024,10/7/2024,Bob,2024-10-03T06:53:00
149,87a6a4dd,High,Open,Software,Computer slow,Help Alice with Computer slow (Software).,6/26/2024,7/4/2024,Alice,2024-06-26T20:06:00
150,0cb7a752,Low,Closed,Software,VPN problem,Alice to resolve VPN problem in Software.,8/27/2024,9/4/2024,Alice,2024-08-27T15:09:00
151,8ac2b25b,Low,Resolved,Network,Login issue,Login issue (Network) — ticket 8ac2b25b.,10/17/2024,10/27/2024,David,2024-10-17T18:27:00
152,a0c81ab8,Critical,In Progress,Security,VPN problem,Critical - VPN problem. Assigned: Grace.,6/13/2024,6/20/2024,Grace,2024-06-13T00:27:00
153,69904e1c,High,Closed,Access,Software install request,Software install request; Access; assigned Carol.,2/3/2024,2/6/2024,Carol,2024-02-03T19:40:00
154,fb033ec1,Low,In Progress,Software,Computer slow,Computer slow reported; David handling; Low.,3/15/2024,3/26/2024,David,2024-03-15T08:15:00
155,68383622,Critical,Resolved,Security,Login issue,Login issue; Security; assigned David.,9/27/2024,10/5/2024,David,2024-09-27T15:58:00
156,461554cd,High,Open,Hardware,Email not working,Help David with Email not working (Hardware).,7/5/2024,7/6/2024,David,2024-07-05T21:13:00
157,00d5324a,Low,Open,Access,Login issue,Access - Login issue. Priority: Low.,6/10/2024,,Carol,2024-06-10T00:22:00
158,37c0530d,Low,Closed,Security,Login issue,Login issue — Security ticket assigned to Grace.,7/2/2024,7/5/2024,Grace,2024-07-02T17:15:00
159,719afd8d,High,Open,Software,VPN problem,High priority: VPN problem (Software).,3/29/2024,,Alice,2024-03-29T20:02:00
160,d225d295,Low,In Progress,Access,Computer slow,Low priority: Computer slow (Access).,6/17/2024,6/21/2024,Carol,2024-06-17T01:03:00
161,91885a56,Low,Open,Security,Login issue,Login issue (Security) — ticket 91885a56.,1/26/2024,,Alice,2024-01-26T17:18:00
162,956b74e1,High,Closed,Hardware,Software install request,Software install request; Hardware; assigned Carol.,8/22/2024,8/29/2024,Carol,2024-08-22T20:45:00
163,eff5de40,Critical,Resolved,Software,Login issue,Login issue — Software ticket assigned to Alice.,9/25/2024,,Alice,2024-09-25T11:55:00
164,7a733f70,High,Open,Hardware,Software install request,Software install request reported; Carol handling; High.,8/8/2024,,Carol,2024-08-08T03:57:00
165,573a621b,Medium,In Progress,Network,Login issue,Network - Login issue. Priority: Medium.,6/11/2024,,Carol,2024-06-11T08:38:00
166,1ea47d1a,Low,Open,Access,Software install request,Software install request; Access; assigned Bob.,8/14/2024,,Bob,2024-08-14T03:55:00
167,0245f17a,Low,In Progress,Network,Login issue,Login issue — Network ticket assigned to David.,1/26/2024,2/2/2024,David,2024-01-26T22:18:00
168,0f22572f,Medium,Closed,Access,Email not working,Access - Email not working. Priority: Medium.,7/7/2024,7/10/2024,Alice,2024-07-07T01:49:00
169,109e26f6,Critical,Resolved,Hardware,Login issue,Critical - Login issue. Assigned: Frank.,6/11/2024,6/21/2024,Frank,2024-06-11T07:57:00
170,723ac0c8,Critical,Resolved,Security,Software install request,Critical - Software install request. Assigned: Eve.,10/16/2024,10/23/2024,Eve,2024-10-16T09:31:00
171,884a1596,Low,Open,Access,Computer slow,Bob to resolve Computer slow in Access.,2/26/2024,3/8/2024,Bob,2024-02-26T18:06:00
172,1cb07dd3,High,Closed,Network,Login issue,Login issue; Network; assigned Grace.,7/1/2024,7/11/2024,Grace,2024-07-01T01:59:00
173,f4ad0af3,Low,In Progress,Network,Software install request,Low priority: Software install request (Network).,1/23/2024,2/1/2024,Frank,2024-01-23T21:19:00
174,e17b3dd5,Low,In Progress,Access,Email not working,Low - Email not working. Assigned: Eve.,10/15/2024,10/21/2024,Eve,2024-10-15T16:42:00
175,c87f9cd1,Critical,Closed,Software,Software install request,Carol to resolve Software install request in Software.,10/1/2024,10/6/2024,Carol,2024-10-01T14:52:00
176,db0a2208,High,Open,Software,Email not working,Email not working; Software; assigned David.,9/19/2024,9/26/2024,David,2024-09-19T10:13:00
177,459e7230,High,Resolved,Network,Computer slow,Help David with Computer slow (Network).,1/7/2024,1/16/2024,David,2024-01-07T23:06:00
178,807feee0,Critical,Resolved,Access,Computer slow,Help Bob with Computer slow (Access).,1/28/2024,2/7/2024,Bob,2024-01-28T22:57:00
179,6e857fbb,High,Open,Security,Email not working,High - Email not working. Assigned: David.,9/15/2024,9/18/2024,David,2024-09-15T00:04:00
180,21318d8a,Low,Resolved,Access,Software install request,Software install request; Access; assigned Alice.,10/15/2024,10/23/2024,Alice,2024-10-15T21:48:00
181,da137988,Critical,In Progress,Hardware,Login issue,Help Frank with Login issue (Hardware).,1/29/2024,,Frank,2024-01-29T00:45:00
182,5bd65679,Medium,In Progress,Security,Login issue,Security issue: Login issue — see ticket 5bd65679.,9/4/2024,,Grace,2024-09-04T01:51:00
183,8a57409c,Critical,Open,Security,VPN problem,VPN problem — Security ticket assigned to Alice.,3/12/2024,3/19/2024,Alice,2024-03-12T15:51:00
184,8fb04af3,Low,In Progress,Security,VPN problem,Security issue: VPN problem — see ticket 8fb04af3.,1/31/2024,,Carol,2024-01-31T07:27:00
185,3c0a272b,Low,In Progress,Hardware,VPN problem,VPN problem — Hardware ticket assigned to David.,3/25/2024,3/31/2024,David,2024-03-25T07:12:00
186,f9c3e5ea,Medium,Resolved,Access,VPN problem,VPN problem — Access ticket assigned to Frank.,7/26/2024,7/26/2024,Frank,2024-07-26T13:12:00
187,6e28b821,Medium,Resolved,Access,Computer slow,Computer slow reported; Bob handling; Medium.,9/3/2024,9/5/2024,Bob,2024-09-03T18:26:00
188,3a070c97,Low,Closed,Hardware,Email not working,Email not working — Hardware ticket assigned to David.,10/4/2024,10/14/2024,David,2024-10-04T20:27:00
189,a1ce473e,High,Resolved,Software,Computer slow,Help Frank with Computer slow (Software).,10/8/2024,10/15/2024,Frank,2024-10-08T08:49:00
190,bb95378a,Medium,Open,Network,Login issue,Network - Login issue. Priority: Medium.,5/30/2024,6/4/2024,Grace,2024-05-30T02:47:00
191,8fbe68e8,Critical,Resolved,Security,Computer slow,Help Eve with Computer slow (Security).,6/25/2024,6/29/2024,Eve,2024-06-25T07:01:00
192,99695715,Medium,Closed,Software,Email not working,Bob to resolve Email not working in Software.,3/23/2024,3/28/2024,Bob,2024-03-23T22:25:00
193,45072e7e,Medium,In Progress,Network,Software install request,Network issue: Software install request — see ticket 45072e7e.,5/27/2024,6/6/2024,Carol,2024-05-27T06:35:00
194,c85bc1d8,High,Closed,Software,VPN problem,Frank to resolve VPN problem in Software.,8/23/2024,,Frank,2024-08-23T05:45:00
195,312ef5a9,Low,Open,Access,Login issue,Alice to resolve Login issue in Access.,6/2/2024,6/2/2024,Alice,2024-06-02T06:56:00
196,3fa3d034,High,Open,Network,Computer slow,Network - Computer slow. Priority: High.,8/6/2024,,Bob,2024-08-06T06:06:00
197,48adbde7,Medium,In Progress,Access,VPN problem,Medium - VPN problem. Assigned: Eve.,9/29/2024,9/29/2024,Eve,2024-09-29T16:29:00
198,4111c2ff,Low,Resolved,Network,Computer slow,Low - Computer slow. Assigned: Eve.,8/5/2024,8/7/2024,Eve,2024-08-05T17:28:00
199,f7c4c06b,Low,In Progress,Access,Login issue,Help Carol with Login issue (Access).,1/28/2024,2/2/2024,Carol,2024-01-28T23:37:00
200,814bc2c5,Medium,Open,Network,VPN problem,Network - VPN problem. Priority: Medium.,5/30/2024,,David,2024-05-30T15:41:00
201,eaa10c5a,Low,Open,Software,VPN problem,VPN problem — Software ticket assigned to Alice.,9/20/2024,9/23/2024,Alice,2024-09-20T16:22:00
202,e98668a9,Low,Closed,Hardware,Software install request,Software install request (Hardware) — ticket e98668a9.,10/8/2024,,Bob,2024-10-08T07:47:00
203,138b02a4,High,Closed,Security,Software install request,Software install request reported; Eve handling; High.,10/17/2024,,Eve,2024-10-17T07:42:00
204,2834d635,Critical,Open,Access,VPN problem,VPN problem (Access) — ticket 2834d635.,10/26/2024,10/31/2024,David,2024-10-26T20:19:00
205,272d1f4a,Critical,Closed,Software,Computer slow,Computer slow (Software) — ticket 272d1f4a.,2/2/2024,2/11/2024,Carol,2024-02-02T10:55:00
206,d836a7a8,Low,Resolved,Hardware,Email not working,Help David with Email not working (Hardware).,7/19/2024,7/19/2024,David,2024-07-19T04:38:00
207,6d6bc1df,Critical,Resolved,Hardware,VPN problem,Critical priority: VPN problem (Hardware).,9/30/2024,10/7/2024,David,2024-09-30T08:57:00
208,ed21ab6d,High,In Progress,Security,Software install request,Software install request; Security; assigned Eve.,2/14/2024,,Eve,2024-02-14T08:07:00
209,2785393f,High,Resolved,Hardware,VPN problem,VPN problem — Hardware ticket assigned to Alice.,6/9/2024,6/19/2024,Alice,2024-06-09T13:01:00
210,7101709c,Critical,Closed,Access,Email not working,Email not working — Access ticket assigned to Bob.,2/4/2024,,Bob,2024-02-04T09:37:00
211,32c9931f,Low,In Progress,Software,Login issue,Low - Login issue. Assigned: David.,9/12/2024,9/20/2024,David,2024-09-12T02:58:00
212,9a8e5db8,Low,In Progress,Security,VPN problem,VPN problem; Security; assigned Alice.,3/25/2024,3/26/2024,Alice,2024-03-25T15:22:00
213,e591f2fe,Critical,Closed,Software,Login issue,Login issue; Software; assigned David.,6/21/2024,6/29/2024,David,2024-06-21T22:35:00
214,266a3790,Medium,In Progress,Network,Login issue,Login issue reported; Alice handling; Medium.,7/14/2024,7/25/2024,Alice,2024-07-14T02:37:00
215,4395a743,Low,In Progress,Security,Computer slow,Low - Computer slow. Assigned: Grace.,7/13/2024,7/18/2024,Grace,2024-07-13T02:33:00
216,e7e08409,Low,Closed,Network,Computer slow,Low priority: Computer slow (Network).,5/17/2024,5/23/2024,Frank,2024-05-17T09:38:00
217,552011be,High,Resolved,Security,Software install request,Help Frank with Software install request (Security).,1/7/2024,,Frank,2024-01-07T08:09:00
218,828b7024,Medium,In Progress,Security,VPN problem,VPN problem; Security; assigned Bob.,4/25/2024,5/4/2024,Bob,2024-04-25T14:31:00
219,3c9ad09a,Low,In Progress,Hardware,Computer slow,Computer slow; Hardware; assigned Bob.,4/23/2024,4/28/2024,Bob,2024-04-23T00:17:00
220,ebd3609e,High,In Progress,Access,VPN problem,VPN problem — Access ticket assigned to Eve.,1/7/2024,1/12/2024,Eve,2024-01-07T00:55:00
221,85d406c5,Medium,Resolved,Software,Software install request,Medium priority: Software install request (Software).,1/28/2024,1/29/2024,Eve,2024-01-28T19:42:00
222,739ab575,Medium,Closed,Access,Email not working,Access issue: Email not working — see ticket 739ab575.,3/9/2024,3/16/2024,Bob,2024-03-09T08:26:00
223,b0ac2088,Low,Resolved,Access,Software install request,Software install request — Access ticket assigned to Carol.,9/10/2024,9/12/2024,Carol,2024-09-10T00:34:00
224,41319182,Low,In Progress,Software,Email not working,Software issue: Email not working — see ticket 41319182.,1/5/2024,1/7/2024,Alice,2024-01-05T19:19:00
225,d096ac2c,Medium,Closed,Access,VPN problem,Medium priority: VPN problem (Access).,7/9/2024,7/18/2024,Grace,2024-07-09T17:22:00
226,f1ce4281,Medium,Closed,Security,VPN problem,Help Bob with VPN problem (Security).,1/27/2024,2/5/2024,Bob,2024-01-27T19:01:00
227,f55c82dd,Medium,In Progress,Software,VPN problem,VPN problem; Software; assigned Grace.,8/14/2024,8/16/2024,Grace,2024-08-14T09:35:00
228,0ef023a9,High,In Progress,Access,Email not working,Access - Email not working. Priority: High.,9/9/2024,9/17/2024,Grace,2024-09-09T07:38:00
229,1fe91796,Medium,Resolved,Security,VPN problem,Security - VPN problem. Priority: Medium.,1/19/2024,1/23/2024,Frank,2024-01-19T08:01:00
230,9dfe0401,Medium,Open,Software,Login issue,Software issue: Login issue — see ticket 9dfe0401.,5/20/2024,5/29/2024,Alice,2024-05-20T19:41:00
231,a88d25be,High,Open,Hardware,VPN problem,VPN problem — Hardware ticket assigned to Alice.,7/2/2024,7/3/2024,Alice,2024-07-02T12:59:00
232,79cf1f11,Medium,Open,Hardware,Email not working,Email not working — Hardware ticket assigned to David.,7/23/2024,7/24/2024,David,2024-07-23T04:38:00
233,6e9f0ef8,Low,Closed,Software,VPN problem,VPN problem — Software ticket assigned to Alice.,9/27/2024,9/29/2024,Alice,2024-09-27T16:27:00
234,5e5f28e6,High,Open,Network,Email not working,Network issue: Email not working — see ticket 5e5f28e6.,1/10/2024,1/17/2024,David,2024-01-10T12:09:00
235,3680f32a,Low,Open,Hardware,Login issue,Login issue — Hardware ticket assigned to Frank.,6/12/2024,,Frank,2024-06-12T00:11:00
236,b441ff2a,Medium,In Progress,Software,Login issue,Medium - Login issue. Assigned: Bob.,4/20/2024,,Bob,2024-04-20T18:15:00
237,44cc1c39,Critical,Open,Software,Computer slow,Computer slow (Software) — ticket 44cc1c39.,6/24/2024,7/2/2024,Alice,2024-06-24T00:05:00
238,677f1401,Low,Closed,Hardware,Email not working,Alice to resolve Email not working in Hardware.,1/26/2024,2/2/2024,Alice,2024-01-26T00:48:00
239,90e5c018,Medium,Resolved,Software,VPN problem,VPN problem; Software; assigned Grace.,1/2/2024,1/3/2024,Grace,2024-01-02T09:04:00
240,d7a56fab,Medium,Open,Network,Software install request,Software install request (Network) — ticket d7a56fab.,10/15/2024,10/23/2024,Frank,2024-10-15T10:14:00
241,6ec3d429,Medium,In Progress,Security,Email not working,Help Grace with Email not working (Security).,9/2/2024,9/8/2024,Grace,2024-09-02T10:05:00
242,684bc0f0,Critical,Open,Hardware,Computer slow,Critical - Computer slow. Assigned: Carol.,6/1/2024,6/10/2024,Carol,2024-06-01T02:20:00
243,cc623df6,High,Open,Software,Email not working,Software - Email not working. Priority: High.,3/11/2024,,Grace,2024-03-11T15:18:00
244,6d1a504f,Low,In Progress,Hardware,Email not working,Email not working (Hardware) — ticket 6d1a504f.,2/26/2024,,Eve,2024-02-26T04:44:00
245,5b33e68a,Medium,Closed,Software,Computer slow,Computer slow; Software; assigned Carol.,1/16/2024,1/19/2024,Carol,2024-01-16T01:25:00
246,7ae3cfb7,Low,In Progress,Software,Software install request,Low - Software install request. Assigned: Grace.,10/19/2024,,Grace,2024-10-19T17:05:00
247,47e476e5,Medium,Closed,Hardware,Computer slow,Computer slow reported; Bob handling; Medium.,2/13/2024,,Bob,2024-02-13T04:40:00
248,0692443d,Medium,In Progress,Access,VPN problem,Help Alice with VPN problem (Access).,1/14/2024,1/15/2024,Alice,2024-01-14T14:09:00
249,e6875d03,High,Open,Access,Email not working,Email not working; Access; assigned Alice.,6/3/2024,6/8/2024,Alice,2024-06-03T02:46:00
250,97b3f690,Medium,In Progress,Access,Email not working,Email not working; Access; assigned Bob.,3/27/2024,3/30/2024,Bob,2024-03-27T22:23:00
251,34efcd8c,Low,In Progress,Network,Email not working,Email not working reported; Grace handling; Low.,2/27/2024,,Grace,2024-02-27T14:56:00
252,a6d2dd96,High,Resolved,Access,Login issue,Help Eve with Login issue (Access).,2/25/2024,,Eve,2024-02-25T23:41:00
253,b9324d7b,Low,Closed,Access,Software install request,Software install request; Access; assigned Grace.,9/28/2024,10/1/2024,Grace,2024-09-28T11:01:00
254,bbebbf05,Low,Resolved,Hardware,Login issue,Help Bob with Login issue (Hardware).,6/23/2024,6/25/2024,Bob,2024-06-23T11:14:00
255,e4ffa227,Critical,In Progress,Network,VPN problem,VPN problem — Network ticket assigned to Bob.,5/11/2024,5/14/2024,Bob,2024-05-11T04:13:00
256,d9aa8649,Low,In Progress,Software,Computer slow,Software - Computer slow. Priority: Low.,5/9/2024,5/19/2024,Eve,2024-05-09T19:17:00
257,b084c3c1,Critical,Closed,Software,VPN problem,Software - VPN problem. Priority: Critical.,2/28/2024,3/7/2024,Bob,2024-02-28T02:09:00
258,0b891ebc,Medium,Resolved,Network,Email not working,Email not working; Network; assigned Grace.,6/20/2024,6/22/2024,Grace,2024-06-20T13:07:00
259,a2a79f3d,Critical,Closed,Hardware,Computer slow,Critical - Computer slow. Assigned: Alice.,5/25/2024,5/28/2024,Alice,2024-05-25T12:03:00
260,8044e791,Critical,In Progress,Hardware,Login issue,Hardware - Login issue. Priority: Critical.,1/27/2024,2/6/2024,Alice,2024-01-27T22:14:00
261,0aa52aff,Medium,Closed,Software,Software install request,Software install request (Software) — ticket 0aa52aff.,10/26/2024,11/4/2024,Bob,2024-10-26T09:40:00
262,a74560b2,Low,Open,Access,Computer slow,Computer slow (Access) — ticket a74560b2.,9/14/2024,9/21/2024,David,2024-09-14T08:57:00
263,b53441cc,Medium,Resolved,Software,Computer slow,Computer slow; Software; assigned Eve.,1/4/2024,,Eve,2024-01-04T09:34:00
264,7ff7d610,Low,Resolved,Network,Computer slow,Help Alice with Computer slow (Network).,10/24/2024,10/30/2024,Alice,2024-10-24T00:54:00
265,a741232f,Low,Resolved,Hardware,Computer slow,Computer slow reported; Alice handling; Low.,5/18/2024,5/20/2024,Alice,2024-05-18T06:34:00
266,f4ec5ac2,Medium,Open,Access,Software install request,Medium - Software install request. Assigned: Frank.,3/26/2024,4/2/2024,Frank,2024-03-26T16:28:00
267,46bbcc51,High,Closed,Access,Email not working,Help Frank with Email not working (Access).,5/9/2024,,Frank,2024-05-09T19:09:00
268,68dbbd15,High,Closed,Software,Login issue,High - Login issue. Assigned: Alice.,8/10/2024,,Alice,2024-08-10T03:49:00
269,7907cf8b,High,Resolved,Security,VPN problem,High - VPN problem. Assigned: David.,5/3/2024,5/10/2024,David,2024-05-03T06:42:00
270,80fc5d3d,High,Resolved,Access,VPN problem,VPN problem reported; David handling; High.,9/21/2024,9/26/2024,David,2024-09-21T04:19:00
271,eff9f235,Medium,Closed,Security,Login issue,Help David with Login issue (Security).,10/2/2024,,David,2024-10-02T10:11:00
272,1b1b56e3,High,Closed,Access,Computer slow,Help Carol with Computer slow (Access).,2/16/2024,2/23/2024,Carol,2024-02-16T13:37:00
273,582d9b3e,High,In Progress,Network,Software install request,Software install request reported; Carol handling; High.,4/22/2024,,Carol,2024-04-22T16:15:00
274,e43e7e53,Critical,Resolved,Security,VPN problem,Help Alice with VPN problem (Security).,6/29/2024,,Alice,2024-06-29T07:46:00
275,a9a8c9ff,Medium,Open,Hardware,Email not working,Help Bob with Email not working (Hardware).,6/27/2024,,Bob,2024-06-27T17:34:00
276,e84f5828,Low,Closed,Software,Computer slow,Computer slow; Software; assigned Frank.,10/19/2024,,Frank,2024-10-19T04:52:00
277,93b84226,Low,Resolved,Security,Computer slow,Computer slow; Security; assigned Eve.,1/21/2024,1/26/2024,Eve,2024-01-21T02:51:00
278,c700e15d,Low,Closed,Hardware,Login issue,Login issue; Hardware; assigned Carol.,10/24/2024,,Carol,2024-10-24T15:01:00
279,42598d75,Medium,Closed,Network,Software install request,Software install request — Network ticket assigned to Bob.,9/5/2024,9/13/2024,Bob,2024-09-05T19:52:00
280,9fe5a1c7,Medium,In Progress,Security,Email not working,Medium - Email not working. Assigned: David.,1/5/2024,1/8/2024,David,2024-01-05T12:13:00
281,57749994,Low,Resolved,Security,Software install request,Eve to resolve Software install request in Security.,6/11/2024,6/17/2024,Eve,2024-06-11T11:57:00
282,fd2a3861,Medium,Closed,Software,VPN problem,VPN problem — Software ticket assigned to Frank.,9/19/2024,9/26/2024,Frank,2024-09-19T22:57:00
283,ddf0a3d0,Low,Resolved,Network,Email not working,Email not working — Network ticket assigned to Carol.,4/10/2024,,Carol,2024-04-10T12:08:00
284,5eeba319,Medium,In Progress,Network,VPN problem,Grace to resolve VPN problem in Network.,10/12/2024,,Grace,2024-10-12T19:01:00
285,44166277,Critical,Open,Software,Computer slow,Software issue: Computer slow — see ticket 44166277.,7/5/2024,7/7/2024,Alice,2024-07-05T04:33:00
286,4b98bb84,Critical,Resolved,Software,VPN problem,Software issue: VPN problem — see ticket 4b98bb84.,7/28/2024,7/31/2024,Carol,2024-07-28T20:06:00
287,502187ff,High,Open,Network,Login issue,Login issue — Network ticket assigned to Eve.,6/29/2024,,Eve,2024-06-29T18:20:00
288,a7b8ca25,Medium,In Progress,Software,Software install request,Software install request reported; Grace handling; Medium.,8/1/2024,8/10/2024,Grace,2024-08-01T06:37:00
289,c4a3ef0a,Critical,Closed,Network,VPN problem,VPN problem reported; Carol handling; Critical.,3/14/2024,,Carol,2024-03-14T17:16:00
290,aab3a2c6,Medium,In Progress,Hardware,Email not working,Hardware - Email not working. Priority: Medium.,2/9/2024,2/14/2024,Eve,2024-02-09T14:38:00
291,96a1293c,Low,Resolved,Hardware,Email not working,Email not working — Hardware ticket assigned to David.,7/18/2024,7/20/2024,David,2024-07-18T16:13:00
292,14ab92a2,High,Resolved,Network,VPN problem,Network issue: VPN problem — see ticket 14ab92a2.,3/4/2024,3/7/2024,Frank,2024-03-04T21:17:00
293,c04b23ed,High,In Progress,Security,Computer slow,Computer slow — Security ticket assigned to David.,1/30/2024,2/8/2024,David,2024-01-30T14:25:00
294,d446e18d,Medium,Open,Network,Login issue,Network - Login issue. Priority: Medium.,4/7/2024,4/13/2024,Grace,2024-04-07T18:04:00
295,4183813d,Low,Open,Hardware,Software install request,Help Bob with Software install request (Hardware).,2/7/2024,2/9/2024,Bob,2024-02-07T07:25:00
296,27c89abc,Critical,In Progress,Software,VPN problem,VPN problem; Software; assigned David.,10/20/2024,10/26/2024,David,2024-10-20T05:01:00
297,549bc921,Medium,In Progress,Software,Email not working,Medium priority: Email not working (Software).,10/27/2024,,Carol,2024-10-27T09:51:00
298,bf87d19a,High,Open,Access,Email not working,Access issue: Email not working — see ticket bf87d19a.,9/14/2024,,Bob,2024-09-14T19:32:00
299,000dbe25,Critical,Open,Access,Login issue,Critical - Login issue. Assigned: Carol.,8/23/2024,8/29/2024,Carol,2024-08-23T16:05:00
300,b2aa63f3,Medium,In Progress,Access,VPN problem,Help Eve with VPN problem (Access).,5/1/2024,,Eve,2024-05-01T02:23:00
301,602c6b53,High,Closed,Hardware,Login issue,Login issue — Hardware ticket assigned to Alice.,6/15/2024,6/25/2024,Alice,2024-06-15T05:44:00
302,fb676add,Critical,Open,Security,VPN problem,Help Alice with VPN problem (Security).,6/4/2024,6/11/2024,Alice,2024-06-04T13:49:00
303,a44e1bce,High,Resolved,Security,VPN problem,Security - VPN problem. Priority: High.,3/17/2024,3/27/2024,David,2024-03-17T10:44:00
304,b435d6d1,Low,Resolved,Security,Login issue,Login issue reported; Grace handling; Low.,10/6/2024,10/6/2024,Grace,2024-10-06T00:54:00
305,6867417d,Critical,Open,Network,Software install request,Critical priority: Software install request (Network).,8/11/2024,,Frank,2024-08-11T21:21:00
306,ed8dc945,Medium,Resolved,Access,VPN problem,David to resolve VPN problem in Access.,1/20/2024,1/26/2024,David,2024-01-20T22:19:00
307,81b71026,Medium,Resolved,Access,Email not working,Access - Email not working. Priority: Medium.,3/22/2024,3/26/2024,Eve,2024-03-22T10:41:00
308,511d2332,Medium,Open,Network,Email not working,Email not working; Network; assigned David.,8/30/2024,9/8/2024,David,2024-08-30T00:24:00
309,ab6d0ebe,Critical,Open,Network,Login issue,Network issue: Login issue — see ticket ab6d0ebe.,5/16/2024,,Alice,2024-05-16T13:01:00
310,063c8156,High,In Progress,Access,Computer slow,High priority: Computer slow (Access).,1/3/2024,,David,2024-01-03T04:46:00
311,02346ec1,Medium,Open,Access,Login issue,Login issue; Access; assigned David.,4/4/2024,4/6/2024,David,2024-04-04T07:26:00
312,21140f94,Medium,Open,Security,Software install request,Medium priority: Software install request (Security).,5/10/2024,5/14/2024,David,2024-05-10T12:43:00
313,a83093d8,Low,Open,Network,VPN problem,Low - VPN problem. Assigned: Frank.,3/4/2024,3/9/2024,Frank,2024-03-04T01:17:00
314,90c1f029,Critical,Open,Access,Software install request,Critical - Software install request. Assigned: Eve.,2/5/2024,2/11/2024,Eve,2024-02-05T11:16:00
315,d0eca3f7,Critical,Closed,Hardware,Login issue,Login issue — Hardware ticket assigned to Alice.,6/2/2024,,Alice,2024-06-02T01:21:00
316,f159879f,Medium,In Progress,Software,Computer slow,Computer slow reported; Grace handling; Medium.,7/27/2024,8/3/2024,Grace,2024-07-27T06:57:00
317,f2ae18c4,High,In Progress,Hardware,Computer slow,Hardware - Computer slow. Priority: High.,1/3/2024,1/12/2024,Bob,2024-01-03T00:03:00
318,c0942d84,Critical,Open,Security,VPN problem,VPN problem (Security) — ticket c0942d84.,3/26/2024,3/27/2024,Bob,2024-03-26T06:52:00
319,93d43163,Medium,In Progress,Network,Login issue,Network - Login issue. Priority: Medium.,6/8/2024,6/11/2024,Frank,2024-06-08T01:16:00
320,bc27165f,Medium,In Progress,Network,Email not working,Help Bob with Email not working (Network).,1/20/2024,1/25/2024,Bob,2024-01-20T16:42:00
321,c40fe489,Medium,In Progress,Network,VPN problem,Grace to resolve VPN problem in Network.,5/11/2024,5/19/2024,Grace,2024-05-11T11:25:00
322,d8749ffb,Critical,In Progress,Security,VPN problem,VPN problem (Security) — ticket d8749ffb.,8/21/2024,8/24/2024,Grace,2024-08-21T17:59:00
323,482def05,Low,In Progress,Access,Login issue,Access - Login issue. Priority: Low.,3/27/2024,4/2/2024,Alice,2024-03-27T00:12:00
324,662bfb60,Critical,Closed,Software,Email not working,Email not working (Software) — ticket 662bfb60.,7/10/2024,7/10/2024,Bob,2024-07-10T03:07:00
325,197a5ad6,Medium,Open,Access,Login issue,Access issue: Login issue — see ticket 197a5ad6.,1/21/2024,1/23/2024,Grace,2024-01-21T12:47:00
326,6bbb513a,Low,Closed,Network,Login issue,Network - Login issue. Priority: Low.,2/11/2024,2/12/2024,Alice,2024-02-11T05:02:00
327,0d67b4c2,Critical,Closed,Network,VPN problem,Network - VPN problem. Priority: Critical.,4/26/2024,5/5/2024,David,2024-04-26T01:16:00
328,321cdc49,High,In Progress,Software,Login issue,High - Login issue. Assigned: David.,7/24/2024,,David,2024-07-24T03:53:00
329,eedb640c,Critical,In Progress,Security,VPN problem,Help Bob with VPN problem (Security).,3/23/2024,3/23/2024,Bob,2024-03-23T08:44:00
330,bdd42129,Medium,Open,Access,Email not working,Medium - Email not working. Assigned: David.,7/18/2024,7/19/2024,David,2024-07-18T16:02:00
331,fddac731,Medium,Open,Network,Software install request,Medium priority: Software install request (Network).,1/16/2024,1/22/2024,Frank,2024-01-16T16:06:00
332,04ec2ab8,Low,Closed,Security,Email not working,Email not working; Security; assigned David.,9/14/2024,9/23/2024,David,2024-09-14T19:33:00
333,42edcbc8,High,In Progress,Security,Software install request,High priority: Software install request (Security).,4/23/2024,5/1/2024,Bob,2024-04-23T14:07:00
334,9f2d7ca4,High,Open,Hardware,Software install request,High priority: Software install request (Hardware).,10/5/2024,10/15/2024,David,2024-10-05T17:29:00
335,79653173,Critical,Closed,Hardware,Software install request,Hardware - Software install request. Priority: Critical.,8/30/2024,9/8/2024,Alice,2024-08-30T07:15:00
336,0b15f678,Critical,Open,Security,Software install request,Critical priority: Software install request (Security).,9/12/2024,9/17/2024,David,2024-09-12T01:53:00
337,3f04f7af,Low,Closed,Access,Software install request,Alice to resolve Software install request in Access.,7/29/2024,7/31/2024,Alice,2024-07-29T22:13:00
338,193a63ab,Medium,Closed,Access,Login issue,Medium priority: Login issue (Access).,7/18/2024,7/21/2024,David,2024-07-18T20:53:00
339,6f9cc60a,High,In Progress,Security,VPN problem,Eve to resolve VPN problem in Security.,1/27/2024,1/29/2024,Eve,2024-01-27T13:53:00
340,957d1ed9,Low,In Progress,Security,Email not working,Security issue: Email not working — see ticket 957d1ed9.,6/23/2024,7/1/2024,Bob,2024-06-23T13:08:00
341,30fe485c,Low,In Progress,Access,Login issue,Login issue (Access) — ticket 30fe485c.,2/9/2024,2/11/2024,Carol,2024-02-09T03:35:00
342,b7392097,Low,Open,Security,Email not working,Email not working; Security; assigned Eve.,8/11/2024,8/19/2024,Eve,2024-08-11T06:28:00
343,1986c400,High,In Progress,Hardware,Login issue,Login issue reported; Grace handling; High.,5/24/2024,,Grace,2024-05-24T07:39:00
344,2f897c37,Low,Closed,Access,Login issue,Low priority: Login issue (Access).,3/4/2024,3/11/2024,David,2024-03-04T18:51:00
345,89100397,Medium,Resolved,Hardware,Login issue,Medium - Login issue. Assigned: Bob.,7/21/2024,7/27/2024,Bob,2024-07-21T03:40:00
346,178a798b,High,In Progress,Hardware,Computer slow,Hardware issue: Computer slow — see ticket 178a798b.,2/22/2024,3/4/2024,David,2024-02-22T18:09:00
347,a322dc7c,High,Open,Access,Email not working,Help Grace with Email not working (Access).,5/13/2024,,Grace,2024-05-13T04:32:00
348,beb2ec0e,Low,In Progress,Network,Email not working,Low - Email not working. Assigned: Eve.,1/21/2024,1/31/2024,Eve,2024-01-21T21:09:00
349,1965bde7,Medium,Closed,Access,Computer slow,Computer slow — Access ticket assigned to Carol.,9/3/2024,9/11/2024,Carol,2024-09-03T03:04:00
350,3d34b2e0,Medium,Resolved,Access,Computer slow,Computer slow reported; Bob handling; Medium.,1/24/2024,,Bob,2024-01-24T00:50:00
351,67f39ef1,Low,Open,Security,Login issue,Low priority: Login issue (Security).,8/6/2024,8/7/2024,Alice,2024-08-06T07:56:00
352,7ac830f9,Critical,Closed,Software,Login issue,Login issue — Software ticket assigned to David.,3/19/2024,,David,2024-03-19T07:49:00
353,787b3e73,High,In Progress,Security,Email not working,Email not working — Security ticket assigned to Carol.,6/13/2024,6/17/2024,Carol,2024-06-13T13:00:00
354,d422a154,Medium,In Progress,Software,Software install request,Medium priority: Software install request (Software).,3/10/2024,3/11/2024,Eve,2024-03-10T06:10:00
355,cfdd4c29,Critical,In Progress,Hardware,Software install request,Software install request (Hardware) — ticket cfdd4c29.,2/8/2024,,Bob,2024-02-08T15:20:00
356,b4713cdf,Low,Resolved,Hardware,VPN problem,Hardware issue: VPN problem — see ticket b4713cdf.,3/27/2024,4/5/2024,Grace,2024-03-27T00:38:00
357,83849255,Low,Resolved,Security,Login issue,Low - Login issue. Assigned: David.,9/6/2024,,David,2024-09-06T02:53:00
358,8c2cf21d,High,Closed,Software,Software install request,Grace to resolve Software install request in Software.,8/29/2024,,Grace,2024-08-29T08:43:00
359,ab2135e6,High,Closed,Security,Email not working,High priority: Email not working (Security).,6/12/2024,6/14/2024,Frank,2024-06-12T12:45:00
360,bddc634c,High,In Progress,Access,Computer slow,Access - Computer slow. Priority: High.,9/29/2024,10/5/2024,Carol,2024-09-29T14:05:00
361,66de825d,Medium,In Progress,Security,Computer slow,Bob to resolve Computer slow in Security.,3/5/2024,3/15/2024,Bob,2024-03-05T21:33:00
362,dcb1915f,High,Closed,Hardware,Login issue,Help Eve with Login issue (Hardware).,6/13/2024,6/20/2024,Eve,2024-06-13T13:26:00
363,fe81cf63,Critical,Resolved,Hardware,Login issue,Critical priority: Login issue (Hardware).,8/30/2024,9/3/2024,Eve,2024-08-30T02:59:00
364,b689f72b,Medium,Resolved,Security,Login issue,Login issue; Security; assigned Grace.,10/26/2024,11/3/2024,Grace,2024-10-26T03:33:00
365,a566f71f,Critical,Open,Network,Computer slow,Computer slow reported; Frank handling; Critical.,1/5/2024,1/9/2024,Frank,2024-01-05T07:20:00
366,33e3f998,Low,In Progress,Security,Email not working,Low - Email not working. Assigned: David.,3/31/2024,4/3/2024,David,2024-03-31T02:09:00
367,8ede74d8,High,In Progress,Network,Email not working,High priority: Email not working (Network).,1/24/2024,1/26/2024,Carol,2024-01-24T21:35:00
368,15de4d32,Medium,Resolved,Software,Computer slow,Frank to resolve Computer slow in Software.,4/20/2024,4/28/2024,Frank,2024-04-20T22:01:00
369,de0e7f9d,Low,Resolved,Network,VPN problem,Help David with VPN problem (Network).,5/3/2024,5/9/2024,David,2024-05-03T11:50:00
370,093aff95,Critical,In Progress,Software,Software install request,Frank to resolve Software install request in Software.,7/4/2024,7/9/2024,Frank,2024-07-04T19:09:00
371,62e32f7e,Low,Open,Access,Email not working,Email not working — Access ticket assigned to Eve.,1/22/2024,2/2/2024,Eve,2024-01-22T11:17:00
372,a6c5df71,Critical,In Progress,Access,Login issue,Critical priority: Login issue (Access).,2/17/2024,2/21/2024,Grace,2024-02-17T00:30:00
373,c91ed5d5,Critical,Open,Access,VPN problem,Help Frank with VPN problem (Access).,6/29/2024,,Frank,2024-06-29T22:58:00
374,48e4b582,Medium,Closed,Access,VPN problem,Medium - VPN problem. Assigned: Frank.,9/22/2024,9/30/2024,Frank,2024-09-22T01:47:00
375,f05b803d,Critical,Open,Hardware,Software install request,Software install request — Hardware ticket assigned to David.,2/7/2024,2/17/2024,David,2024-02-07T13:05:00
376,844f79a8,Medium,Resolved,Security,Email not working,Medium priority: Email not working (Security).,3/5/2024,3/8/2024,Grace,2024-03-05T15:30:00
377,dbdb31f9,High,Resolved,Hardware,Email not working,Hardware - Email not working. Priority: High.,7/23/2024,7/29/2024,Alice,2024-07-23T07:19:00
378,6d786287,Low,In Progress,Network,Software install request,Software install request; Network; assigned Grace.,3/14/2024,3/24/2024,Grace,2024-03-14T23:48:00
379,039d5c4a,High,Open,Hardware,Email not working,Help Grace with Email not working (Hardware).,5/24/2024,6/1/2024,Grace,2024-05-24T20:33:00
380,c7470b34,Low,Open,Software,Computer slow,Low priority: Computer slow (Software).,7/7/2024,7/11/2024,Carol,2024-07-07T00:49:00
381,a0fcdbd7,High,Resolved,Access,Email not working,Access - Email not working. Priority: High.,7/11/2024,7/21/2024,Eve,2024-07-11T10:30:00
382,6a8245fe,Medium,Open,Network,Software install request,Software install request (Network) — ticket 6a8245fe.,1/6/2024,,David,2024-01-06T06:58:00
383,78c679ee,High,In Progress,Access,Computer slow,Computer slow — Access ticket assigned to Grace.,3/25/2024,3/28/2024,Grace,2024-03-25T10:36:00
384,5a17f3af,Medium,Resolved,Security,VPN problem,VPN problem (Security) — ticket 5a17f3af.,3/13/2024,3/23/2024,Alice,2024-03-13T19:33:00
385,f7182547,High,Open,Network,Computer slow,High priority: Computer slow (Network).,9/3/2024,9/11/2024,Bob,2024-09-03T18:56:00
386,ac9ee313,High,Closed,Access,VPN problem,High - VPN problem. Assigned: Alice.,1/12/2024,1/21/2024,Alice,2024-01-12T05:27:00
387,cfb96639,Medium,Closed,Hardware,Email not working,Medium priority: Email not working (Hardware).,3/27/2024,4/4/2024,Grace,2024-03-27T21:31:00
388,20d7f25c,Low,Closed,Hardware,Login issue,Login issue — Hardware ticket assigned to David.,5/12/2024,,David,2024-05-12T08:08:00
389,8575096c,High,In Progress,Access,Computer slow,Computer slow; Access; assigned Alice.,6/16/2024,6/20/2024,Alice,2024-06-16T01:32:00
390,b5a308ee,High,Open,Software,VPN problem,High - VPN problem. Assigned: Alice.,1/15/2024,1/21/2024,Alice,2024-01-15T17:06:00
391,377a64f3,Critical,Open,Network,Email not working,Email not working reported; Alice handling; Critical.,5/13/2024,,Alice,2024-05-13T17:33:00
392,281075c3,High,Closed,Hardware,VPN problem,Hardware issue: VPN problem — see ticket 281075c3.,4/14/2024,4/14/2024,Grace,2024-04-14T01:13:00
393,413b2b1d,Critical,Open,Software,Email not working,Software issue: Email not working — see ticket 413b2b1d.,2/14/2024,2/19/2024,David,2024-02-14T04:44:00
394,788e7a55,Critical,Open,Network,Login issue,Critical - Login issue. Assigned: Eve.,5/8/2024,5/16/2024,Eve,2024-05-08T12:40:00
395,86701425,Medium,Closed,Network,Email not working,Email not working; Network; assigned Bob.,8/17/2024,8/18/2024,Bob,2024-08-17T20:42:00
396,4cd798b2,Critical,Closed,Security,Email not working,Email not working (Security) — ticket 4cd798b2.,9/17/2024,9/26/2024,Bob,2024-09-17T01:41:00
397,95e53db0,Low,Open,Network,Computer slow,Network issue: Computer slow — see ticket 95e53db0.,1/21/2024,1/28/2024,Grace,2024-01-21T17:25:00
398,25cf0636,Medium,Closed,Network,VPN problem,VPN problem — Network ticket assigned to Frank.,3/2/2024,3/3/2024,Frank,2024-03-02T05:23:00
399,4e5d470f,High,Open,Network,Login issue,Help David with Login issue (Network).,6/10/2024,6/20/2024,David,2024-06-10T12:20:00
400,7805707e,Low,Open,Access,VPN problem,Low priority: VPN problem (Access).,6/11/2024,6/15/2024,Frank,2024-06-11T21:37:00
401,704a8559,Medium,Resolved,Software,Software install request,Software install request; Software; assigned Eve.,7/10/2024,7/21/2024,Eve,2024-07-10T11:51:00
402,de3c34eb,Low,Open,Hardware,Login issue,Login issue reported; Eve handling; Low.,1/3/2024,,Eve,2024-01-03T12:05:00
403,521eaaca,Low,Open,Security,Software install request,Security - Software install request. Priority: Low.,8/5/2024,8/6/2024,David,2024-08-05T14:03:00
404,84ff8109,Critical,Open,Hardware,VPN problem,Hardware issue: VPN problem — see ticket 84ff8109.,8/14/2024,,Grace,2024-08-14T00:26:00
405,f8c193b1,High,Closed,Hardware,Software install request,High - Software install request. Assigned: Carol.,6/29/2024,7/1/2024,Carol,2024-06-29T06:54:00
406,c343caf8,Medium,In Progress,Network,Software install request,Software install request — Network ticket assigned to Bob.,1/24/2024,2/1/2024,Bob,2024-01-24T12:20:00
407,59378732,Medium,In Progress,Software,Login issue,Login issue — Software ticket assigned to David.,4/29/2024,5/4/2024,David,2024-04-29T16:42:00
408,fa99ce40,Medium,In Progress,Security,Computer slow,Computer slow — Security ticket assigned to Carol.,9/10/2024,,Carol,2024-09-10T05:06:00
409,18c6f78f,Critical,Resolved,Access,Software install request,Frank to resolve Software install request in Access.,4/15/2024,,Frank,2024-04-15T08:26:00
410,8296dbb9,Medium,Closed,Hardware,VPN problem,Help Eve with VPN problem (Hardware).,8/25/2024,,Eve,2024-08-25T06:22:00
411,387ae387,Medium,Resolved,Hardware,Computer slow,Computer slow; Hardware; assigned David.,2/1/2024,,David,2024-02-01T23:47:00
412,9778f59a,High,Resolved,Network,Login issue,Grace to resolve Login issue in Network.,2/9/2024,2/17/2024,Grace,2024-02-09T21:16:00
413,576a761f,Low,Resolved,Security,VPN problem,VPN problem (Security) — ticket 576a761f.,4/14/2024,4/14/2024,Grace,2024-04-14T03:33:00
414,b6f697a6,Medium,Closed,Access,Computer slow,Medium - Computer slow. Assigned: Carol.,4/12/2024,4/22/2024,Carol,2024-04-12T07:46:00
415,7d7cdef4,Low,Closed,Network,Email not working,Email not working — Network ticket assigned to Bob.,10/7/2024,10/12/2024,Bob,2024-10-07T15:14:00
416,4200b7b3,High,Closed,Software,Software install request,Software issue: Software install request — see ticket 4200b7b3.,2/26/2024,2/29/2024,Carol,2024-02-26T18:30:00
417,5da08b47,Critical,In Progress,Network,VPN problem,Critical - VPN problem. Assigned: Bob.,6/17/2024,6/21/2024,Bob,2024-06-17T16:53:00
418,43857baf,Critical,Open,Hardware,Login issue,David to resolve Login issue in Hardware.,3/11/2024,3/20/2024,David,2024-03-11T08:49:00
419,2109245a,Critical,Resolved,Access,VPN problem,Help Alice with VPN problem (Access).,10/5/2024,,Alice,2024-10-05T06:08:00
420,50a7e88e,Critical,Resolved,Access,VPN problem,Critical priority: VPN problem (Access).,6/25/2024,,Frank,2024-06-25T10:45:00
421,a3523218,Critical,In Progress,Software,Software install request,Software install request — Software ticket assigned to David.,5/17/2024,5/23/2024,David,2024-05-17T21:40:00
422,f8175db2,Low,Resolved,Access,Computer slow,Computer slow — Access ticket assigned to Eve.,7/6/2024,7/14/2024,Eve,2024-07-06T09:34:00
423,ed3cafc1,Medium,Closed,Access,VPN problem,Medium - VPN problem. Assigned: Grace.,9/10/2024,9/10/2024,Grace,2024-09-10T09:30:00
424,c383bfec,Critical,Resolved,Network,Computer slow,Alice to resolve Computer slow in Network.,7/9/2024,7/15/2024,Alice,2024-07-09T04:33:00
425,a7f1991b,Medium,Open,Hardware,Computer slow,Computer slow (Hardware) — ticket a7f1991b.,7/22/2024,,Alice,2024-07-22T19:06:00
426,3a91019f,Medium,In Progress,Software,Login issue,Login issue (Software) — ticket 3a91019f.,6/29/2024,7/2/2024,Grace,2024-06-29T11:03:00
427,1a81e1e0,Critical,Open,Hardware,Computer slow,Critical priority: Computer slow (Hardware).,6/2/2024,6/5/2024,Frank,2024-06-02T08:23:00
428,befc8b50,Low,Resolved,Security,VPN problem,VPN problem (Security) — ticket befc8b50.,5/26/2024,6/2/2024,David,2024-05-26T14:28:00
429,ffc8766d,Medium,In Progress,Software,Email not working,Medium priority: Email not working (Software).,10/10/2024,,Grace,2024-10-10T04:41:00
430,599382aa,Critical,In Progress,Network,Computer slow,Help Carol with Computer slow (Network).,10/4/2024,10/7/2024,Carol,2024-10-04T22:39:00
431,99c125e1,Medium,Resolved,Access,Email not working,Medium priority: Email not working (Access).,10/11/2024,10/15/2024,Frank,2024-10-11T02:52:00
432,83daf3ee,High,In Progress,Security,Login issue,Security - Login issue. Priority: High.,2/13/2024,2/20/2024,Carol,2024-02-13T06:22:00
433,79e63d41,Medium,In Progress,Security,Login issue,Login issue (Security) — ticket 79e63d41.,5/21/2024,5/27/2024,Frank,2024-05-21T22:36:00
434,423abf17,Critical,In Progress,Access,Computer slow,Computer slow; Access; assigned David.,8/14/2024,8/16/2024,David,2024-08-14T05:13:00
435,80c7ea40,Critical,In Progress,Network,VPN problem,VPN problem (Network) — ticket 80c7ea40.,1/6/2024,1/15/2024,Eve,2024-01-06T20:53:00
436,04bba998,Low,Resolved,Software,Login issue,Login issue — Software ticket assigned to Alice.,1/28/2024,2/2/2024,Alice,2024-01-28T19:11:00
437,506ee717,Critical,Open,Hardware,Email not working,Critical priority: Email not working (Hardware).,4/10/2024,4/13/2024,Grace,2024-04-10T08:44:00
438,d75d03c2,Low,Resolved,Network,VPN problem,Eve to resolve VPN problem in Network.,9/20/2024,,Eve,2024-09-20T10:30:00
439,6afbe53c,High,Resolved,Access,Software install request,Software install request — Access ticket assigned to Alice.,5/13/2024,,Alice,2024-05-13T15:14:00
440,bf79509f,High,Open,Security,Software install request,High priority: Software install request (Security).,10/22/2024,10/31/2024,Carol,2024-10-22T20:54:00
441,7b640e09,Critical,Resolved,Access,VPN problem,VPN problem reported; Eve handling; Critical.,2/6/2024,2/7/2024,Eve,2024-02-06T08:44:00
442,ed20fa2e,Critical,Closed,Access,Email not working,Email not working; Access; assigned Grace.,10/6/2024,10/12/2024,Grace,2024-10-06T12:15:00
443,ee57f820,Low,In Progress,Security,Login issue,Security issue: Login issue — see ticket ee57f820.,8/25/2024,8/27/2024,Carol,2024-08-25T04:53:00
444,a4aaad15,Critical,Resolved,Security,Email not working,Email not working reported; Carol handling; Critical.,2/2/2024,,Carol,2024-02-02T12:53:00
445,d772b315,High,In Progress,Access,Software install request,High - Software install request. Assigned: Bob.,9/26/2024,9/29/2024,Bob,2024-09-26T17:59:00
446,5f78a014,High,Closed,Security,VPN problem,Help Alice with VPN problem (Security).,4/28/2024,5/7/2024,Alice,2024-04-28T20:52:00
447,03fb9c41,High,Open,Software,Software install request,Software install request — Software ticket assigned to Bob.,6/12/2024,6/22/2024,Bob,2024-06-12T11:45:00
448,a196e023,Critical,Closed,Security,Email not working,Help Alice with Email not working (Security).,2/11/2024,2/12/2024,Alice,2024-02-11T18:10:00
449,2453656d,Critical,Open,Security,VPN problem,VPN problem — Security ticket assigned to David.,5/21/2024,5/24/2024,David,2024-05-21T13:30:00
450,ab947f89,Low,Closed,Hardware,VPN problem,VPN problem (Hardware) — ticket ab947f89.,5/10/2024,5/20/2024,Eve,2024-05-10T01:26:00
451,999ea507,Medium,In Progress,Access,VPN problem,Medium priority: VPN problem (Access).,9/12/2024,9/14/2024,Grace,2024-09-12T00:59:00
452,b30c0826,Medium,In Progress,Network,VPN problem,VPN problem; Network; assigned Alice.,2/26/2024,3/8/2024,Alice,2024-02-26T11:34:00
453,72d7d378,High,Resolved,Network,VPN problem,VPN problem (Network) — ticket 72d7d378.,8/11/2024,8/15/2024,David,2024-08-11T00:21:00
454,7fba8e50,Critical,In Progress,Security,Computer slow,Eve to resolve Computer slow in Security.,10/22/2024,10/27/2024,Eve,2024-10-22T17:48:00
455,92dead4d,Critical,Closed,Network,Email not working,Help Carol with Email not working (Network).,5/15/2024,5/19/2024,Carol,2024-05-15T15:37:00
456,67bff3ff,Critical,Closed,Access,Login issue,Help Bob with Login issue (Access).,7/23/2024,7/27/2024,Bob,2024-07-23T10:38:00
457,cb939d39,Critical,Closed,Hardware,Email not working,Email not working — Hardware ticket assigned to Bob.,5/14/2024,5/20/2024,Bob,2024-05-14T21:17:00
458,33ca7e50,Medium,Resolved,Access,Software install request,Access - Software install request. Priority: Medium.,8/14/2024,8/14/2024,Frank,2024-08-14T14:58:00
459,891597fb,Medium,Open,Network,VPN problem,VPN problem reported; David handling; Medium.,1/29/2024,2/7/2024,David,2024-01-29T22:18:00
460,994fc923,Medium,Open,Access,Login issue,Medium priority: Login issue (Access).,3/11/2024,3/14/2024,Eve,2024-03-11T16:56:00
461,fa804d05,Critical,Closed,Security,Email not working,Critical priority: Email not working (Security).,2/22/2024,2/26/2024,Carol,2024-02-22T02:50:00
462,1dd7f611,Low,Open,Hardware,VPN problem,Hardware issue: VPN problem — see ticket 1dd7f611.,5/6/2024,5/11/2024,Alice,2024-05-06T06:24:00
463,ce178aa6,Medium,Resolved,Software,Computer slow,Carol to resolve Computer slow in Software.,8/14/2024,8/17/2024,Carol,2024-08-14T04:16:00
464,7e0d5295,Critical,Resolved,Access,VPN problem,VPN problem reported; Alice handling; Critical.,7/17/2024,7/28/2024,Alice,2024-07-17T12:25:00
465,b0706d59,Low,Resolved,Access,Software install request,Software install request; Access; assigned David.,8/11/2024,8/13/2024,David,2024-08-11T06:58:00
466,2f2ee72c,Medium,Resolved,Access,Software install request,Software install request — Access ticket assigned to Alice.,2/3/2024,2/3/2024,Alice,2024-02-03T02:39:00
467,9eabea39,High,Closed,Network,Computer slow,Computer slow — Network ticket assigned to Carol.,1/15/2024,1/23/2024,Carol,2024-01-15T02:49:00
468,8ea4146f,High,Open,Hardware,Software install request,High - Software install request. Assigned: Carol.,5/5/2024,5/8/2024,Carol,2024-05-05T22:40:00
469,92a3ae58,Medium,Closed,Hardware,Login issue,Login issue (Hardware) — ticket 92a3ae58.,9/17/2024,9/18/2024,David,2024-09-17T08:51:00
470,d51d6ee7,Critical,Resolved,Software,Email not working,Email not working reported; Eve handling; Critical.,3/16/2024,,Eve,2024-03-16T18:56:00
471,ccd76447,Medium,Open,Network,Login issue,Login issue (Network) — ticket ccd76447.,5/17/2024,5/26/2024,Bob,2024-05-17T15:57:00
472,ebb2bd83,Critical,Open,Network,Computer slow,Critical - Computer slow. Assigned: Eve.,2/9/2024,,Eve,2024-02-09T08:15:00
473,0766cb77,High,In Progress,Software,Software install request,Help Bob with Software install request (Software).,7/13/2024,7/19/2024,Bob,2024-07-13T21:53:00
474,0343c793,Low,Resolved,Network,Email not working,Email not working; Network; assigned Alice.,6/27/2024,6/28/2024,Alice,2024-06-27T08:00:00
475,512862fa,Critical,Closed,Access,VPN problem,VPN problem; Access; assigned David.,8/19/2024,8/20/2024,David,2024-08-19T07:34:00
476,30f409e3,Medium,Closed,Software,Email not working,Email not working; Software; assigned Bob.,6/16/2024,6/24/2024,Bob,2024-06-16T03:33:00
477,fc0aaadf,High,Resolved,Security,Computer slow,Security issue: Computer slow — see ticket fc0aaadf.,4/8/2024,4/9/2024,Frank,2024-04-08T15:18:00
478,3f477f9f,Critical,Resolved,Network,Login issue,Critical priority: Login issue (Network).,3/22/2024,3/31/2024,Bob,2024-03-22T06:28:00
479,6291e440,Low,Closed,Security,VPN problem,VPN problem reported; Eve handling; Low.,8/18/2024,8/24/2024,Eve,2024-08-18T17:41:00
480,82d911c9,High,Open,Software,Software install request,Frank to resolve Software install request in Software.,1/28/2024,2/2/2024,Frank,2024-01-28T12:15:00
481,08260f0a,Medium,Open,Security,Login issue,Carol to resolve Login issue in Security.,6/1/2024,6/11/2024,Carol,2024-06-01T13:13:00
482,69c9ae20,Medium,In Progress,Hardware,Computer slow,David to resolve Computer slow in Hardware.,4/7/2024,4/12/2024,David,2024-04-07T23:59:00
483,6913b4d9,Medium,Open,Access,Login issue,Access - Login issue. Priority: Medium.,3/5/2024,,Carol,2024-03-05T10:20:00
484,aad959a1,Medium,Resolved,Network,Login issue,Help Eve with Login issue (Network).,5/25/2024,,Eve,2024-05-25T03:52:00
485,4afcb6be,Low,In Progress,Access,VPN problem,VPN problem reported; Carol handling; Low.,2/17/2024,2/20/2024,Carol,2024-02-17T08:42:00
486,45dcbea3,Medium,Resolved,Security,Software install request,Help Carol with Software install request (Security).,2/25/2024,3/6/2024,Carol,2024-02-25T07:32:00
487,1dccd614,Critical,Closed,Network,Software install request,Software install request (Network) — ticket 1dccd614.,1/28/2024,1/31/2024,Carol,2024-01-28T23:17:00
488,3a2f0be5,High,In Progress,Software,Login issue,Carol to resolve Login issue in Software.,7/16/2024,7/17/2024,Carol,2024-07-16T07:29:00
489,f509ccfe,High,In Progress,Network,Software install request,Network - Software install request. Priority: High.,10/5/2024,10/11/2024,Frank,2024-10-05T08:38:00
490,0fa5fb0a,Medium,Closed,Security,VPN problem,VPN problem (Security) — ticket 0fa5fb0a.,9/14/2024,9/16/2024,Grace,2024-09-14T14:14:00
491,fae804b8,Medium,Open,Security,VPN problem,Help Alice with VPN problem (Security).,10/26/2024,10/28/2024,Alice,2024-10-26T01:29:00
492,9220797e,Critical,In Progress,Software,Computer slow,Bob to resolve Computer slow in Software.,4/6/2024,4/7/2024,Bob,2024-04-06T20:20:00
493,6264faac,Medium,In Progress,Software,Email not working,Medium - Email not working. Assigned: David.,4/6/2024,4/17/2024,David,2024-04-06T08:41:00
494,dfa33b05,High,In Progress,Network,Software install request,David to resolve Software install request in Network.,1/12/2024,1/23/2024,David,2024-01-12T12:45:00
495,bf401b40,High,Resolved,Network,Email not working,Eve to resolve Email not working in Network.,5/6/2024,,Eve,2024-05-06T07:29:00
496,21186d72,Critical,Resolved,Security,Email not working,Security - Email not working. Priority: Critical.,10/22/2024,10/28/2024,Bob,2024-10-22T19:58:00
497,81531ab0,Medium,In Progress,Software,Email not working,Medium - Email not working. Assigned: David.,9/14/2024,9/16/2024,David,2024-09-14T12:09:00
498,47d33a63,Critical,In Progress,Network,Email not working,Email not working; Network; assigned David.,3/19/2024,,David,2024-03-19T05:11:00
499,5da80ab6,Low,Resolved,Software,VPN problem,Software - VPN problem. Priority: Low.,3/26/2024,4/2/2024,Frank,2024-03-26T20:59:00
500,f2309667,High,In Progress,Software,Login issue,High - Login issue. Assigned: Grace.,2/13/2024,2/17/2024,Grace,2024-02-13T19:41:00
501,d404c3d1,High,Resolved,Hardware,Computer slow,Carol to resolve Computer slow in Hardware.,2/22/2024,2/25/2024,Carol,2024-02-22T05:16:00
502,291fd078,Critical,Resolved,Software,Login issue,Critical priority: Login issue (Software).,2/21/2024,2/29/2024,David,2024-02-21T18:49:00
503,9e3eaa0c,High,Closed,Hardware,Email not working,Hardware - Email not working. Priority: High.,6/13/2024,,Alice,2024-06-13T01:07:00
504,366be9f3,Critical,Open,Hardware,Login issue,Login issue — Hardware ticket assigned to David.,7/2/2024,7/10/2024,David,2024-07-02T21:33:00
505,0dabf383,Medium,In Progress,Software,Computer slow,Computer slow — Software ticket assigned to David.,4/27/2024,5/4/2024,David,2024-04-27T18:56:00
506,489298b8,Low,Open,Security,VPN problem,Low priority: VPN problem (Security).,7/14/2024,7/19/2024,Alice,2024-07-14T20:53:00
507,f361f76f,Critical,Open,Hardware,Login issue,Hardware issue: Login issue — see ticket f361f76f.,1/29/2024,2/4/2024,Carol,2024-01-29T11:46:00
508,0600a832,High,In Progress,Network,Email not working,Email not working (Network) — ticket 0600a832.,1/27/2024,1/28/2024,Bob,2024-01-27T08:03:00
509,04d25ff4,Medium,Closed,Access,VPN problem,VPN problem — Access ticket assigned to Bob.,6/2/2024,6/10/2024,Bob,2024-06-02T04:38:00
510,2cdfa641,High,Closed,Software,Software install request,Software install request reported; Carol handling; High.,4/8/2024,4/18/2024,Carol,2024-04-08T00:53:00
511,e8f7f505,Low,Open,Access,Login issue,Low priority: Login issue (Access).,4/30/2024,,Grace,2024-04-30T20:21:00
512,404c36b2,Low,Closed,Hardware,Computer slow,Bob to resolve Computer slow in Hardware.,2/18/2024,,Bob,2024-02-18T02:06:00
513,d8a4d9ef,High,Resolved,Network,Email not working,Email not working (Network) — ticket d8a4d9ef.,9/22/2024,,Bob,2024-09-22T00:37:00
514,5c75cfcb,High,Resolved,Access,VPN problem,Frank to resolve VPN problem in Access.,3/12/2024,3/18/2024,Frank,2024-03-12T21:35:00
515,ad695658,Critical,Resolved,Security,VPN problem,VPN problem — Security ticket assigned to Carol.,8/1/2024,8/7/2024,Carol,2024-08-01T02:04:00
516,695011ac,Critical,In Progress,Network,Software install request,Alice to resolve Software install request in Network.,10/10/2024,10/20/2024,Alice,2024-10-10T14:54:00
517,a7019ca2,Critical,In Progress,Hardware,VPN problem,VPN problem; Hardware; assigned Alice.,5/10/2024,,Alice,2024-05-10T15:28:00
518,003420a1,Low,Open,Network,Computer slow,Network - Computer slow. Priority: Low.,4/9/2024,4/14/2024,David,2024-04-09T02:12:00
519,b8e76aee,Low,Resolved,Hardware,Login issue,Hardware - Login issue. Priority: Low.,2/21/2024,2/27/2024,Alice,2024-02-21T13:09:00
520,282ac147,Medium,Resolved,Access,VPN problem,Medium - VPN problem. Assigned: David.,7/9/2024,,David,2024-07-09T12:11:00
521,055c4ff0,High,In Progress,Security,VPN problem,VPN problem reported; Carol handling; High.,8/4/2024,8/10/2024,Carol,2024-08-04T15:55:00
522,4d1a614c,Critical,In Progress,Access,Software install request,Critical priority: Software install request (Access).,9/21/2024,9/27/2024,Bob,2024-09-21T11:57:00
523,9c3c9d4b,High,Resolved,Access,Login issue,Login issue; Access; assigned Bob.,9/9/2024,9/10/2024,Bob,2024-09-09T07:52:00
524,0aeb49b2,Critical,Resolved,Access,Computer slow,Computer slow; Access; assigned David.,9/10/2024,9/17/2024,David,2024-09-10T13:36:00
525,c241e871,High,Closed,Security,VPN problem,VPN problem; Security; assigned Bob.,8/9/2024,8/17/2024,Bob,2024-08-09T06:43:00
526,78c30f02,High,In Progress,Software,VPN problem,Frank to resolve VPN problem in Software.,10/2/2024,10/13/2024,Frank,2024-10-02T13:33:00
527,1a06622e,Medium,In Progress,Network,Login issue,Medium priority: Login issue (Network).,8/21/2024,8/27/2024,Frank,2024-08-21T11:17:00
528,49f580fb,Low,In Progress,Security,Email not working,Help Carol with Email not working (Security).,10/22/2024,10/24/2024,Carol,2024-10-22T13:39:00
529,cb248180,Medium,In Progress,Network,VPN problem,Medium priority: VPN problem (Network).,4/3/2024,4/8/2024,Bob,2024-04-03T05:11:00
530,90abb46b,Critical,Closed,Security,Login issue,Login issue reported; David handling; Critical.,2/27/2024,3/7/2024,David,2024-02-27T00:18:00
531,31872f46,Low,In Progress,Software,Login issue,Login issue (Software) — ticket 31872f46.,8/4/2024,8/6/2024,Bob,2024-08-04T07:38:00
532,db6ee129,Medium,In Progress,Security,VPN problem,Medium - VPN problem. Assigned: Eve.,1/17/2024,1/17/2024,Eve,2024-01-17T18:54:00
533,274919bc,High,Open,Network,Computer slow,Help Eve with Computer slow (Network).,3/24/2024,4/3/2024,Eve,2024-03-24T11:39:00
534,dd60a27d,Critical,Resolved,Access,Email not working,Access - Email not working. Priority: Critical.,2/10/2024,2/12/2024,Carol,2024-02-10T00:18:00
535,9ee9258e,Critical,In Progress,Network,Software install request,Critical - Software install request. Assigned: David.,4/14/2024,,David,2024-04-14T00:21:00
536,df9d9fd8,High,In Progress,Access,Software install request,Software install request — Access ticket assigned to Frank.,5/8/2024,,Frank,2024-05-08T05:57:00
537,de8fc411,Medium,Open,Network,Software install request,Medium priority: Software install request (Network).,4/29/2024,,Grace,2024-04-29T17:09:00
538,ae2d80a5,High,In Progress,Access,Software install request,Access issue: Software install request — see ticket ae2d80a5.,9/8/2024,,David,2024-09-08T14:13:00
539,17b53fab,Medium,In Progress,Software,Computer slow,Medium priority: Computer slow (Software).,3/27/2024,,Alice,2024-03-27T21:04:00
540,6da5ab2e,Low,In Progress,Access,VPN problem,VPN problem — Access ticket assigned to Grace.,7/24/2024,7/27/2024,Grace,2024-07-24T17:42:00
541,98ae0118,Critical,Open,Security,Login issue,Help Bob with Login issue (Security).,9/7/2024,9/13/2024,Bob,2024-09-07T18:12:00
542,bd1bc0c6,Medium,Closed,Network,VPN problem,VPN problem reported; Alice handling; Medium.,5/12/2024,5/17/2024,Alice,2024-05-12T18:34:00
543,7e943a5e,Critical,Closed,Network,Software install request,Network - Software install request. Priority: Critical.,2/5/2024,2/14/2024,Alice,2024-02-05T03:06:00
544,792918a5,Critical,Closed,Software,Login issue,Login issue; Software; assigned Grace.,6/24/2024,6/26/2024,Grace,2024-06-24T13:37:00
545,564347,Critical,Resolved,Access,Email not working,Email not working — Access ticket assigned to David.,5/15/2024,5/20/2024,David,2024-05-15T11:07:00
546,566b5bff,Low,Resolved,Software,Software install request,Software install request (Software) — ticket 566b5bff.,4/30/2024,5/10/2024,Eve,2024-04-30T11:22:00
547,7afab6f0,Medium,Open,Network,Email not working,Eve to resolve Email not working in Network.,4/25/2024,4/26/2024,Eve,2024-04-25T23:17:00
548,e7ef8a1b,Medium,Resolved,Security,Email not working,Email not working reported; Grace handling; Medium.,8/5/2024,,Grace,2024-08-05T05:20:00
549,7d2949de,Critical,Closed,Hardware,Computer slow,Help Frank with Computer slow (Hardware).,8/25/2024,9/2/2024,Frank,2024-08-25T11:46:00
550,26b5b4b7,Medium,Resolved,Access,Software install request,Access - Software install request. Priority: Medium.,10/13/2024,,Alice,2024-10-13T10:11:00
551,96ec023e,High,Closed,Hardware,Email not working,Hardware issue: Email not working — see ticket 96ec023e.,10/16/2024,10/21/2024,Alice,2024-10-16T09:02:00
552,1e05df31,Low,Closed,Hardware,Computer slow,Computer slow — Hardware ticket assigned to Frank.,8/24/2024,,Frank,2024-08-24T04:27:00
553,a078af62,Critical,In Progress,Hardware,Email not working,Hardware - Email not working. Priority: Critical.,4/7/2024,4/18/2024,Eve,2024-04-07T22:49:00
554,b63658df,Medium,Open,Network,Software install request,Software install request (Network) — ticket b63658df.,2/8/2024,2/13/2024,David,2024-02-08T12:35:00
555,b85908ed,High,Open,Network,Computer slow,Computer slow reported; Alice handling; High.,5/28/2024,6/8/2024,Alice,2024-05-28T17:03:00
556,56d51324,Critical,In Progress,Hardware,Email not working,Email not working; Hardware; assigned Alice.,7/13/2024,7/17/2024,Alice,2024-07-13T14:23:00
557,ca14cfc9,High,Resolved,Access,Login issue,Login issue (Access) — ticket ca14cfc9.,10/18/2024,10/22/2024,Bob,2024-10-18T19:30:00
558,94acaecb,Medium,Open,Software,Email not working,Software issue: Email not working — see ticket 94acaecb.,3/25/2024,,Alice,2024-03-25T08:42:00
559,e2425411,Medium,Closed,Security,Login issue,Medium - Login issue. Assigned: David.,1/21/2024,1/24/2024,David,2024-01-21T21:16:00
560,24c8b371,Medium,Closed,Network,VPN problem,VPN problem; Network; assigned Bob.,6/13/2024,,Bob,2024-06-13T13:18:00
561,5543557,Low,In Progress,Hardware,Email not working,Email not working — Hardware ticket assigned to Frank.,4/24/2024,4/24/2024,Frank,2024-04-24T21:00:00
562,96aaa332,Low,In Progress,Hardware,Email not working,Help Frank with Email not working (Hardware).,7/22/2024,,Frank,2024-07-22T21:32:00
563,71d49fd3,Medium,In Progress,Software,Software install request,Software install request; Software; assigned Bob.,4/1/2024,4/4/2024,Bob,2024-04-01T01:16:00
564,2134367c,High,Resolved,Hardware,Login issue,High priority: Login issue (Hardware).,3/15/2024,3/18/2024,David,2024-03-15T06:40:00
565,a3eadc93,Critical,Open,Hardware,VPN problem,Hardware - VPN problem. Priority: Critical.,9/11/2024,9/12/2024,Grace,2024-09-11T15:46:00
566,94462dfd,Low,Open,Security,Computer slow,Security - Computer slow. Priority: Low.,2/14/2024,2/24/2024,Eve,2024-02-14T04:11:00
567,d2cd0421,Low,In Progress,Software,Login issue,Software issue: Login issue — see ticket d2cd0421.,6/7/2024,6/11/2024,Carol,2024-06-07T09:56:00
568,949c3614,Low,Open,Software,Login issue,Software issue: Login issue — see ticket 949c3614.,9/1/2024,9/10/2024,Eve,2024-09-01T14:28:00
569,3ff52026,Low,Open,Network,VPN problem,Network issue: VPN problem — see ticket 3ff52026.,4/5/2024,4/9/2024,Alice,2024-04-05T16:07:00
570,5925ec02,Critical,Open,Security,VPN problem,VPN problem (Security) — ticket 5925ec02.,8/6/2024,8/7/2024,Eve,2024-08-06T22:46:00
571,5df0b37c,Medium,Open,Security,Email not working,Security - Email not working. Priority: Medium.,4/4/2024,4/6/2024,Grace,2024-04-04T06:38:00
572,8e6082c4,High,In Progress,Hardware,Computer slow,Computer slow reported; Grace handling; High.,8/22/2024,,Grace,2024-08-22T10:48:00
573,4c6d154b,Medium,In Progress,Hardware,Email not working,Medium - Email not working. Assigned: Alice.,6/13/2024,,Alice,2024-06-13T08:52:00
574,3ef7e404,Low,Open,Hardware,Login issue,Hardware - Login issue. Priority: Low.,6/29/2024,7/4/2024,Carol,2024-06-29T19:56:00
575,0289f8c6,High,Open,Hardware,Computer slow,Help Carol with Computer slow (Hardware).,3/22/2024,3/27/2024,Carol,2024-03-22T04:55:00
576,66000109,High,Open,Software,Login issue,Login issue reported; Eve handling; High.,7/1/2024,7/4/2024,Eve,2024-07-01T20:08:00
577,7035c7db,Medium,Resolved,Access,Software install request,Alice to resolve Software install request in Access.,10/26/2024,11/3/2024,Alice,2024-10-26T11:11:00
578,cf094fa0,Medium,In Progress,Software,VPN problem,Software issue: VPN problem — see ticket cf094fa0.,6/18/2024,,Eve,2024-06-18T18:12:00
579,17808996,Low,Open,Security,Login issue,Login issue reported; Grace handling; Low.,5/12/2024,5/22/2024,Grace,2024-05-12T17:15:00
580,fa33ab76,Medium,Open,Security,Computer slow,Medium - Computer slow. Assigned: Alice.,9/13/2024,9/16/2024,Alice,2024-09-13T06:02:00
581,dcf54eb0,Low,In Progress,Network,Email not working,Email not working (Network) — ticket dcf54eb0.,3/5/2024,3/12/2024,Alice,2024-03-05T11:55:00
582,6db903b8,Medium,Closed,Security,VPN problem,VPN problem reported; Grace handling; Medium.,5/9/2024,,Grace,2024-05-09T16:37:00
583,266086cb,Low,Closed,Hardware,Software install request,Low - Software install request. Assigned: Frank.,8/26/2024,8/27/2024,Frank,2024-08-26T09:47:00
584,c97dda6e,High,Open,Security,Email not working,Email not working; Security; assigned Eve.,1/28/2024,2/2/2024,Eve,2024-01-28T00:36:00
585,e51aad7a,High,Closed,Security,Software install request,High priority: Software install request (Security).,6/2/2024,6/5/2024,Grace,2024-06-02T01:37:00
586,f16fdab9,High,Closed,Software,VPN problem,VPN problem — Software ticket assigned to Grace.,10/16/2024,10/24/2024,Grace,2024-10-16T16:48:00
587,8738f93a,Critical,Resolved,Security,VPN problem,Critical priority: VPN problem (Security).,10/21/2024,10/29/2024,Alice,2024-10-21T05:23:00
588,203c0089,Medium,Resolved,Security,Email not working,Email not working reported; Alice handling; Medium.,4/18/2024,4/24/2024,Alice,2024-04-18T13:24:00
589,98526ca7,High,Resolved,Security,Computer slow,Security issue: Computer slow — see ticket 98526ca7.,4/17/2024,,Bob,2024-04-17T05:21:00
590,10ccc80c,High,Resolved,Network,Login issue,Eve to resolve Login issue in Network.,10/27/2024,11/5/2024,Eve,2024-10-27T15:01:00
591,b2abe331,High,In Progress,Software,Login issue,Login issue; Software; assigned Bob.,2/25/2024,2/28/2024,Bob,2024-02-25T16:06:00
592,85b53507,Low,In Progress,Software,Software install request,Low - Software install request. Assigned: Bob.,3/23/2024,3/25/2024,Bob,2024-03-23T00:59:00
593,12f74ef5,Medium,In Progress,Access,Software install request,Medium - Software install request. Assigned: Grace.,10/21/2024,10/31/2024,Grace,2024-10-21T17:56:00
594,2c6027f0,Critical,Resolved,Software,VPN problem,VPN problem; Software; assigned Bob.,6/26/2024,6/28/2024,Bob,2024-06-26T22:38:00
595,4baf3bd8,Critical,Closed,Hardware,Login issue,Login issue reported; Grace handling; Critical.,9/6/2024,9/14/2024,Grace,2024-09-06T07:00:00
596,bd594e6c,High,Open,Software,Email not working,Email not working (Software) — ticket bd594e6c.,6/23/2024,,Eve,2024-06-23T10:26:00
597,06c75b83,Low,In Progress,Access,Email not working,Email not working (Access) — ticket 06c75b83.,2/5/2024,2/8/2024,Frank,2024-02-05T04:41:00
598,f65ee926,High,In Progress,Hardware,VPN problem,Hardware issue: VPN problem — see ticket f65ee926.,6/22/2024,6/22/2024,Eve,2024-06-22T15:21:00
599,4846e0fc,Critical,In Progress,Security,Software install request,Critical priority: Software install request (Security).,9/3/2024,9/13/2024,Alice,2024-09-03T19:41:00
600,075bc03d,High,In Progress,Access,Computer slow,Computer slow — Access ticket assigned to Frank.,7/31/2024,8/11/2024,Frank,2024-07-31T21:43:00
601,61ffea51,Low,Resolved,Network,Email not working,David to resolve Email not working in Network.,6/18/2024,,David,2024-06-18T16:42:00
602,770c3b98,Critical,Resolved,Access,Email not working,Email not working reported; David handling; Critical.,1/10/2024,1/16/2024,David,2024-01-10T14:06:00
603,8bb0f867,Low,Open,Access,Computer slow,David to resolve Computer slow in Access.,8/15/2024,8/17/2024,David,2024-08-15T05:15:00
604,b0e99d0c,High,In Progress,Software,Email not working,Email not working; Software; assigned Carol.,6/25/2024,6/27/2024,Carol,2024-06-25T19:34:00
605,290245ec,Critical,In Progress,Security,Email not working,Critical priority: Email not working (Security).,8/14/2024,8/18/2024,Eve,2024-08-14T22:31:00
606,ee432f55,Low,Resolved,Hardware,Email not working,Help Grace with Email not working (Hardware).,5/20/2024,5/29/2024,Grace,2024-05-20T10:42:00
607,c74a8bd7,High,Open,Security,Login issue,Security issue: Login issue — see ticket c74a8bd7.,3/13/2024,3/17/2024,Grace,2024-03-13T08:54:00
608,fb8ab3da,Critical,Open,Network,Email not working,Critical priority: Email not working (Network).,7/7/2024,7/15/2024,Frank,2024-07-07T23:26:00
609,614e0500,Medium,Resolved,Security,VPN problem,VPN problem; Security; assigned David.,1/4/2024,1/9/2024,David,2024-01-04T04:27:00
610,dc199d18,Critical,Closed,Hardware,Software install request,Hardware issue: Software install request — see ticket dc199d18.,6/15/2024,,Carol,2024-06-15T22:14:00
611,84e76530,High,Closed,Software,Email not working,Email not working; Software; assigned Alice.,4/2/2024,4/11/2024,Alice,2024-04-02T12:05:00
612,22d6ac66,Critical,Closed,Network,Email not working,Email not working (Network) — ticket 22d6ac66.,9/4/2024,9/15/2024,Eve,2024-09-04T22:36:00
613,e90619ee,Medium,Resolved,Software,Login issue,Login issue; Software; assigned Frank.,8/25/2024,9/3/2024,Frank,2024-08-25T16:38:00
614,8637b8fe,High,Closed,Access,Login issue,Help Alice with Login issue (Access).,4/8/2024,4/10/2024,Alice,2024-04-08T14:54:00
615,4a6f0c7d,High,Closed,Access,VPN problem,Access - VPN problem. Priority: High.,3/19/2024,3/20/2024,Grace,2024-03-19T16:35:00
616,59601625,High,Resolved,Software,Software install request,Help Grace with Software install request (Software).,10/23/2024,10/26/2024,Grace,2024-10-23T04:04:00
617,c1f2dbf8,Critical,Closed,Software,Software install request,Critical priority: Software install request (Software).,9/1/2024,9/10/2024,Carol,2024-09-01T09:15:00
618,478744cf,High,Closed,Hardware,VPN problem,VPN problem — Hardware ticket assigned to Carol.,10/17/2024,10/18/2024,Carol,2024-10-17T19:22:00
619,a7b4cb1b,Medium,Resolved,Security,Login issue,Carol to resolve Login issue in Security.,1/1/2024,1/5/2024,Carol,2024-01-01T05:46:00
620,8ccd5bdb,Critical,In Progress,Security,Computer slow,Alice to resolve Computer slow in Security.,4/21/2024,4/25/2024,Alice,2024-04-21T02:22:00
621,9864b513,Low,Closed,Network,Software install request,Software install request; Network; assigned Eve.,6/6/2024,6/17/2024,Eve,2024-06-06T18:31:00
622,8d7887e4,Medium,Open,Software,VPN problem,Help Bob with VPN problem (Software).,1/14/2024,1/21/2024,Bob,2024-01-14T18:49:00
623,6e2ee104,Critical,Resolved,Hardware,Computer slow,Frank to resolve Computer slow in Hardware.,3/31/2024,3/31/2024,Frank,2024-03-31T06:11:00
624,101b7370,High,Closed,Software,Email not working,Help Frank with Email not working (Software).,4/23/2024,,Frank,2024-04-23T08:44:00
625,ef13c1d3,Critical,In Progress,Hardware,Email not working,David to resolve Email not working in Hardware.,9/19/2024,,David,2024-09-19T22:00:00
626,334898a6,Critical,Closed,Hardware,VPN problem,VPN problem; Hardware; assigned Bob.,4/30/2024,5/3/2024,Bob,2024-04-30T11:06:00
627,f15d9088,Medium,Resolved,Network,Email not working,Email not working (Network) — ticket f15d9088.,4/25/2024,5/1/2024,David,2024-04-25T16:13:00
628,d51e3b40,Medium,Closed,Security,Computer slow,Security issue: Computer slow — see ticket d51e3b40.,8/6/2024,8/13/2024,Eve,2024-08-06T13:22:00
629,da529848,Medium,Resolved,Hardware,Software install request,Help Bob with Software install request (Hardware).,4/6/2024,4/15/2024,Bob,2024-04-06T03:56:00
630,99144bf1,Low,Resolved,Hardware,Software install request,Help David with Software install request (Hardware).,1/6/2024,1/7/2024,David,2024-01-06T02:13:00
631,a572091b,Low,Resolved,Access,VPN problem,Access - VPN problem. Priority: Low.,1/8/2024,1/17/2024,Alice,2024-01-08T16:40:00
632,93423b2b,High,Closed,Software,Email not working,Email not working — Software ticket assigned to Carol.,2/20/2024,3/2/2024,Carol,2024-02-20T06:07:00
633,cd8e743d,Medium,Open,Access,VPN problem,Grace to resolve VPN problem in Access.,8/7/2024,8/14/2024,Grace,2024-08-07T17:34:00
634,5b9fbab6,Low,Resolved,Security,Login issue,Login issue reported; Eve handling; Low.,8/15/2024,8/19/2024,Eve,2024-08-15T23:56:00
635,3e96255c,Low,Open,Security,Software install request,Software install request — Security ticket assigned to Eve.,9/15/2024,,Eve,2024-09-15T02:38:00
636,cb37b386,Medium,In Progress,Access,Email not working,Medium priority: Email not working (Access).,6/10/2024,,Grace,2024-06-10T12:05:00
637,d8121ff5,Low,Open,Software,Login issue,Bob to resolve Login issue in Software.,5/26/2024,6/6/2024,Bob,2024-05-26T18:14:00
638,4b54d9d0,Critical,Open,Hardware,Login issue,Hardware - Login issue. Priority: Critical.,2/17/2024,2/17/2024,Frank,2024-02-17T05:54:00
639,f24fa37d,Low,Resolved,Network,Computer slow,Network issue: Computer slow — see ticket f24fa37d.,5/17/2024,5/28/2024,Alice,2024-05-17T23:03:00
640,22837137,Low,Resolved,Security,VPN problem,VPN problem (Security) — ticket 22837137.,3/17/2024,3/25/2024,Grace,2024-03-17T02:23:00
641,134d0c1a,Critical,Open,Security,Email not working,Email not working (Security) — ticket 134d0c1a.,7/10/2024,7/21/2024,Bob,2024-07-10T20:35:00
642,1744f1a3,High,Open,Network,Login issue,High - Login issue. Assigned: David.,2/20/2024,2/29/2024,David,2024-02-20T20:07:00
643,63849fa6,High,Closed,Hardware,Login issue,Hardware issue: Login issue — see ticket 63849fa6.,6/19/2024,6/25/2024,Grace,2024-06-19T13:40:00
644,a8214e1f,Low,Open,Network,Computer slow,Help Alice with Computer slow (Network).,3/30/2024,3/30/2024,Alice,2024-03-30T10:00:00
645,df4687c3,Medium,Open,Security,Email not working,Email not working reported; Grace handling; Medium.,6/18/2024,6/24/2024,Grace,2024-06-18T10:53:00
646,8ceee451,Critical,In Progress,Network,Email not working,Critical - Email not working. Assigned: Grace.,2/12/2024,2/22/2024,Grace,2024-02-12T12:14:00
647,79a81d1b,Critical,Open,Network,Email not working,Network - Email not working. Priority: Critical.,6/17/2024,6/18/2024,Carol,2024-06-17T09:17:00
648,96a96455,Medium,In Progress,Network,VPN problem,Help Eve with VPN problem (Network).,10/1/2024,10/7/2024,Eve,2024-10-01T01:20:00
649,a24b0d35,Medium,Open,Network,Computer slow,Help Eve with Computer slow (Network).,10/4/2024,10/14/2024,Eve,2024-10-04T14:23:00
650,897f327a,Medium,Open,Access,Email not working,Help Grace with Email not working (Access).,4/18/2024,4/19/2024,Grace,2024-04-18T04:00:00
651,047836d5,Medium,Resolved,Security,Login issue,Login issue reported; Frank handling; Medium.,9/11/2024,9/17/2024,Frank,2024-09-11T18:20:00
652,d4cb9636,Low,Closed,Hardware,Software install request,Low - Software install request. Assigned: David.,5/20/2024,,David,2024-05-20T07:38:00
653,9fe7b587,Critical,Closed,Software,Software install request,Software install request; Software; assigned Frank.,5/18/2024,5/27/2024,Frank,2024-05-18T10:46:00
654,681be7b7,Medium,In Progress,Network,Computer slow,Frank to resolve Computer slow in Network.,2/17/2024,2/18/2024,Frank,2024-02-17T08:05:00
655,a9a80a34,High,In Progress,Software,Computer slow,Computer slow reported; Bob handling; High.,4/20/2024,4/28/2024,Bob,2024-04-20T01:47:00
656,17e7a8ce,Critical,Open,Security,Computer slow,Security - Computer slow. Priority: Critical.,7/6/2024,7/10/2024,Eve,2024-07-06T16:59:00
657,314d2e1a,Critical,In Progress,Hardware,Login issue,Hardware issue: Login issue — see ticket 314d2e1a.,8/27/2024,8/28/2024,Grace,2024-08-27T15:20:00
658,9e889321,Medium,Resolved,Network,Computer slow,Network issue: Computer slow — see ticket 9e889321.,5/3/2024,5/12/2024,Bob,2024-05-03T03:22:00
659,57ceb8b0,Critical,Closed,Hardware,VPN problem,VPN problem — Hardware ticket assigned to Grace.,1/10/2024,1/18/2024,Grace,2024-01-10T04:07:00
660,b11a737f,Low,Resolved,Hardware,VPN problem,VPN problem reported; Bob handling; Low.,5/18/2024,5/21/2024,Bob,2024-05-18T20:30:00
661,39d869b8,High,Closed,Security,Software install request,Software install request (Security) — ticket 39d869b8.,6/6/2024,,Eve,2024-06-06T13:49:00
662,9fa0fbab,High,Closed,Network,Software install request,Network - Software install request. Priority: High.,7/22/2024,7/30/2024,Carol,2024-07-22T12:30:00
663,83caad93,High,Closed,Network,Login issue,David to resolve Login issue in Network.,8/31/2024,9/1/2024,David,2024-08-31T03:08:00
664,927e91a7,Critical,Resolved,Network,Computer slow,Computer slow — Network ticket assigned to Grace.,9/21/2024,9/27/2024,Grace,2024-09-21T12:38:00
665,b4efa14e,Critical,Resolved,Access,Login issue,Access - Login issue. Priority: Critical.,8/11/2024,8/20/2024,Alice,2024-08-11T16:43:00
666,5a298e18,Low,In Progress,Network,VPN problem,Help Frank with VPN problem (Network).,5/23/2024,,Frank,2024-05-23T20:52:00
667,41180b7d,Critical,Resolved,Hardware,Software install request,Software install request — Hardware ticket assigned to Frank.,1/9/2024,,Frank,2024-01-09T09:45:00
668,28bcc0b8,Critical,In Progress,Access,VPN problem,VPN problem reported; David handling; Critical.,9/12/2024,9/20/2024,David,2024-09-12T14:01:00
669,2f302606,Critical,In Progress,Security,VPN problem,Help David with VPN problem (Security).,10/15/2024,10/18/2024,David,2024-10-15T01:19:00
670,6120c33f,Low,Resolved,Security,Login issue,Alice to resolve Login issue in Security.,2/15/2024,2/17/2024,Alice,2024-02-15T10:39:00
671,302ee875,High,In Progress,Access,Computer slow,Access - Computer slow. Priority: High.,6/9/2024,6/10/2024,David,2024-06-09T16:32:00
672,5e7ad800,Low,Closed,Hardware,Email not working,Email not working; Hardware; assigned Grace.,9/13/2024,9/16/2024,Grace,2024-09-13T06:04:00
673,3bc14914,Low,Closed,Security,Software install request,Security - Software install request. Priority: Low.,7/30/2024,8/3/2024,Alice,2024-07-30T22:58:00
674,1ba28b0f,Low,Open,Software,Email not working,Low - Email not working. Assigned: Carol.,7/25/2024,,Carol,2024-07-25T20:06:00
675,fec78acd,High,Resolved,Access,Computer slow,Computer slow; Access; assigned Bob.,7/5/2024,7/13/2024,Bob,2024-07-05T21:59:00
676,d6e0c258,Critical,Resolved,Software,VPN problem,VPN problem reported; Eve handling; Critical.,6/14/2024,6/21/2024,Eve,2024-06-14T18:04:00
677,c1754d14,High,Resolved,Security,Login issue,Login issue (Security) — ticket c1754d14.,1/14/2024,,Grace,2024-01-14T22:56:00
678,ea1dd30e,Medium,Closed,Access,Software install request,Software install request reported; Frank handling; Medium.,8/19/2024,,Frank,2024-08-19T01:45:00
679,5be70900,Medium,Closed,Security,Email not working,Help Frank with Email not working (Security).,5/29/2024,6/9/2024,Frank,2024-05-29T22:52:00
680,9642712,Low,Resolved,Network,Computer slow,Network issue: Computer slow — see ticket 09642712.,4/7/2024,4/13/2024,Bob,2024-04-07T09:56:00
681,5159fa84,Low,In Progress,Access,Login issue,David to resolve Login issue in Access.,1/19/2024,1/22/2024,David,2024-01-19T21:37:00
682,25e270de,Medium,In Progress,Software,Computer slow,Computer slow — Software ticket assigned to Carol.,5/19/2024,5/24/2024,Carol,2024-05-19T18:18:00
683,552086d3,Critical,Resolved,Security,Login issue,Critical priority: Login issue (Security).,3/9/2024,3/16/2024,Eve,2024-03-09T13:26:00
684,c62a3cc7,Critical,In Progress,Software,Email not working,Software - Email not working. Priority: Critical.,4/1/2024,4/4/2024,David,2024-04-01T16:58:00
685,35ce8419,High,Closed,Network,Login issue,Network - Login issue. Priority: High.,3/21/2024,3/30/2024,Eve,2024-03-21T09:52:00
686,c4dba712,Medium,Open,Software,Login issue,Login issue — Software ticket assigned to Eve.,10/1/2024,10/5/2024,Eve,2024-10-01T00:54:00
687,2ffde80b,Low,Resolved,Network,Login issue,Frank to resolve Login issue in Network.,10/25/2024,11/3/2024,Frank,2024-10-25T22:06:00
688,4c260d4a,High,Resolved,Access,Email not working,Access issue: Email not working — see ticket 4c260d4a.,3/30/2024,4/6/2024,David,2024-03-30T23:07:00
689,916f1276,Critical,Open,Access,Login issue,Critical - Login issue. Assigned: David.,8/21/2024,9/1/2024,David,2024-08-21T14:05:00
690,ac85d9a5,Low,Closed,Security,VPN problem,VPN problem (Security) — ticket ac85d9a5.,4/27/2024,5/8/2024,David,2024-04-27T10:10:00
691,4ab38619,Critical,Resolved,Security,Login issue,Security issue: Login issue — see ticket 4ab38619.,7/30/2024,,David,2024-07-30T00:31:00
692,e01bb550,Low,Open,Hardware,Email not working,Low priority: Email not working (Hardware).,6/20/2024,,Alice,2024-06-20T20:49:00
693,6579052,Low,Closed,Security,Software install request,Security - Software install request. Priority: Low.,6/18/2024,6/28/2024,Alice,2024-06-18T04:18:00
694,f92dd2a0,Medium,Closed,Network,Software install request,Software install request reported; Grace handling; Medium.,5/5/2024,5/14/2024,Grace,2024-05-05T10:35:00
695,8383046f,Medium,Open,Hardware,Software install request,Software install request; Hardware; assigned Eve.,2/15/2024,2/24/2024,Eve,2024-02-15T12:20:00
696,6f566443,High,Closed,Hardware,Email not working,Hardware - Email not working. Priority: High.,6/23/2024,6/28/2024,Eve,2024-06-23T18:27:00
697,f60f3d66,Medium,Resolved,Software,VPN problem,Software issue: VPN problem — see ticket f60f3d66.,1/17/2024,1/20/2024,Eve,2024-01-17T17:10:00
698,8d5c372a,Critical,Resolved,Access,Software install request,David to resolve Software install request in Access.,5/28/2024,5/31/2024,David,2024-05-28T21:45:00
699,70dd0bfe,High,Resolved,Security,Email not working,Email not working — Security ticket assigned to Eve.,5/22/2024,5/30/2024,Eve,2024-05-22T08:01:00
700,51a5be03,High,Closed,Security,Software install request,Help Carol with Software install request (Security).,5/3/2024,5/13/2024,Carol,2024-05-03T16:38:00
701,b3216d49,Critical,In Progress,Network,Email not working,Frank to resolve Email not working in Network.,1/31/2024,2/4/2024,Frank,2024-01-31T18:22:00
702,b97645bc,Low,Closed,Software,Email not working,Email not working (Software) — ticket b97645bc.,7/6/2024,7/9/2024,Frank,2024-07-06T20:46:00
703,8f20be0f,Medium,Closed,Hardware,Login issue,Login issue; Hardware; assigned Bob.,4/20/2024,,Bob,2024-04-20T10:29:00
704,bbdc6147,Medium,Resolved,Hardware,Software install request,Hardware - Software install request. Priority: Medium.,7/20/2024,7/29/2024,Carol,2024-07-20T03:49:00
705,80095a96,Medium,In Progress,Access,Email not working,Email not working — Access ticket assigned to Alice.,5/17/2024,5/23/2024,Alice,2024-05-17T07:55:00
706,04f01e4b,Critical,Open,Security,Software install request,Critical priority: Software install request (Security).,4/7/2024,,Eve,2024-04-07T02:04:00
707,f826c27e,High,Closed,Hardware,Login issue,Help Grace with Login issue (Hardware).,6/25/2024,6/27/2024,Grace,2024-06-25T08:02:00
708,2837b58c,Medium,In Progress,Access,Computer slow,Access issue: Computer slow — see ticket 2837b58c.,2/10/2024,2/17/2024,Alice,2024-02-10T15:45:00
709,30008360,Low,Resolved,Software,Email not working,Email not working — Software ticket assigned to Eve.,6/11/2024,6/13/2024,Eve,2024-06-11T09:54:00
710,4d975297,High,Open,Access,Software install request,High - Software install request. Assigned: Alice.,6/27/2024,6/27/2024,Alice,2024-06-27T17:00:00
711,813f03fd,Critical,In Progress,Network,Login issue,Network - Login issue. Priority: Critical.,3/9/2024,3/17/2024,Eve,2024-03-09T08:22:00
712,c9067d6d,Medium,Open,Software,Email not working,Help Frank with Email not working (Software).,10/8/2024,10/12/2024,Frank,2024-10-08T14:13:00
713,abb6fe9e,Medium,Resolved,Network,VPN problem,David to resolve VPN problem in Network.,5/18/2024,5/28/2024,David,2024-05-18T08:47:00
714,d61ca189,High,In Progress,Hardware,VPN problem,High - VPN problem. Assigned: Frank.,7/10/2024,7/12/2024,Frank,2024-07-10T06:24:00
715,0dda746c,Low,Resolved,Software,Email not working,Software issue: Email not working — see ticket 0dda746c.,10/21/2024,10/23/2024,David,2024-10-21T23:02:00
716,b0b86fab,Low,Closed,Security,Software install request,Low - Software install request. Assigned: Grace.,8/3/2024,8/8/2024,Grace,2024-08-03T23:26:00
717,422e3da5,Medium,In Progress,Access,Computer slow,Computer slow reported; Alice handling; Medium.,10/11/2024,10/21/2024,Alice,2024-10-11T23:25:00
718,bdd3e808,Medium,In Progress,Access,Email not working,Access issue: Email not working — see ticket bdd3e808.,2/7/2024,2/14/2024,Alice,2024-02-07T09:42:00
719,f4a7b4ba,Critical,Closed,Network,VPN problem,VPN problem (Network) — ticket f4a7b4ba.,6/16/2024,6/26/2024,Alice,2024-06-16T23:56:00
720,81e036fd,High,Closed,Network,Computer slow,Help Grace with Computer slow (Network).,5/12/2024,5/22/2024,Grace,2024-05-12T06:45:00
721,cb026856,Medium,In Progress,Network,VPN problem,Network issue: VPN problem — see ticket cb026856.,6/1/2024,6/7/2024,Frank,2024-06-01T08:34:00
722,3a2eda8c,High,Closed,Hardware,Email not working,Hardware - Email not working. Priority: High.,2/14/2024,2/20/2024,Eve,2024-02-14T12:18:00
723,6a6d6857,Low,Open,Security,Computer slow,Help Bob with Computer slow (Security).,3/13/2024,3/20/2024,Bob,2024-03-13T18:12:00
724,b03f20cd,Low,Resolved,Security,Login issue,Login issue (Security) — ticket b03f20cd.,3/31/2024,4/6/2024,Alice,2024-03-31T15:02:00
725,efefa164,Medium,Resolved,Access,VPN problem,Access - VPN problem. Priority: Medium.,5/18/2024,5/19/2024,Grace,2024-05-18T20:08:00
726,23249d8a,Critical,Closed,Hardware,Login issue,Login issue — Hardware ticket assigned to David.,9/3/2024,9/13/2024,David,2024-09-03T14:32:00
727,c11a6511,High,In Progress,Network,Software install request,Software install request reported; Eve handling; High.,4/19/2024,4/22/2024,Eve,2024-04-19T10:24:00
728,7.88E+103,Critical,In Progress,Software,VPN problem,Critical priority: VPN problem (Software).,2/22/2024,3/2/2024,Bob,2024-02-22T22:18:00
729,6dd30b70,Low,In Progress,Network,Login issue,Login issue — Network ticket assigned to Frank.,7/14/2024,,Frank,2024-07-14T11:21:00
730,5069dbec,Critical,In Progress,Software,Email not working,Software issue: Email not working — see ticket 5069dbec.,3/2/2024,3/5/2024,Frank,2024-03-02T01:17:00
731,dbaf57c9,Medium,Open,Network,Email not working,Medium - Email not working. Assigned: David.,8/25/2024,8/29/2024,David,2024-08-25T05:59:00
732,fc27baab,Critical,Open,Security,VPN problem,VPN problem (Security) — ticket fc27baab.,4/8/2024,4/13/2024,Frank,2024-04-08T11:20:00
733,d5b88511,Medium,Resolved,Network,Login issue,Login issue; Network; assigned Grace.,3/16/2024,,Grace,2024-03-16T01:25:00
734,650a02f1,Critical,In Progress,Access,Email not working,Email not working reported; Grace handling; Critical.,8/5/2024,8/11/2024,Grace,2024-08-05T03:18:00
735,e0da7d2e,High,Closed,Software,VPN problem,Alice to resolve VPN problem in Software.,3/21/2024,3/22/2024,Alice,2024-03-21T00:44:00
736,eda0a1ba,Medium,Closed,Hardware,Login issue,Login issue reported; Frank handling; Medium.,6/26/2024,6/27/2024,Frank,2024-06-26T14:39:00
737,c2917a1d,Critical,In Progress,Hardware,Computer slow,Hardware issue: Computer slow — see ticket c2917a1d.,10/17/2024,,Bob,2024-10-17T04:17:00
738,1469d925,High,Closed,Hardware,Computer slow,Hardware - Computer slow. Priority: High.,4/20/2024,4/28/2024,David,2024-04-20T20:31:00
739,c91c1905,Critical,Resolved,Access,Login issue,Critical - Login issue. Assigned: Bob.,1/3/2024,,Bob,2024-01-03T09:06:00
740,352c202b,High,In Progress,Hardware,Software install request,Software install request (Hardware) — ticket 352c202b.,4/30/2024,5/4/2024,Bob,2024-04-30T10:09:00
741,9ed9f95f,Medium,Open,Software,Software install request,David to resolve Software install request in Software.,1/9/2024,1/14/2024,David,2024-01-09T05:34:00
742,fd8bbae6,Low,In Progress,Access,Email not working,Email not working reported; David handling; Low.,3/30/2024,4/6/2024,David,2024-03-30T06:55:00
743,04f1c042,Critical,Open,Software,Login issue,Login issue reported; Bob handling; Critical.,8/31/2024,9/1/2024,Bob,2024-08-31T20:56:00
744,1ec3c573,High,In Progress,Network,Software install request,Network - Software install request. Priority: High.,7/9/2024,,Carol,2024-07-09T10:00:00
745,3e227af5,Low,Closed,Software,Computer slow,Software issue: Computer slow — see ticket 3e227af5.,5/23/2024,5/29/2024,Carol,2024-05-23T09:09:00
746,264a398d,Critical,In Progress,Software,Software install request,Software install request reported; Carol handling; Critical.,2/26/2024,3/3/2024,Carol,2024-02-26T20:03:00
747,6bbc9d06,Critical,Resolved,Security,Email not working,Frank to resolve Email not working in Security.,8/29/2024,9/9/2024,Frank,2024-08-29T23:22:00
748,b1893b51,Critical,In Progress,Network,Login issue,Login issue (Network) — ticket b1893b51.,9/7/2024,9/18/2024,Grace,2024-09-07T07:04:00
749,5cfd8342,Critical,Open,Hardware,Computer slow,Computer slow reported; Eve handling; Critical.,2/10/2024,2/13/2024,Eve,2024-02-10T03:56:00
750,f0627c77,High,Open,Security,Email not working,Help Bob with Email not working (Security).,7/8/2024,7/15/2024,Bob,2024-07-08T01:12:00
751,114b8650,High,Resolved,Access,Email not working,Access - Email not working. Priority: High.,8/20/2024,8/26/2024,Alice,2024-08-20T18:45:00
752,7529fddc,Critical,Resolved,Network,Computer slow,Help Frank with Computer slow (Network).,8/23/2024,9/2/2024,Frank,2024-08-23T17:00:00
753,59493fcd,High,Resolved,Security,Email not working,Security - Email not working. Priority: High.,4/22/2024,5/1/2024,David,2024-04-22T15:37:00
754,b3d3879d,Low,In Progress,Software,Computer slow,Low priority: Computer slow (Software).,5/25/2024,5/29/2024,Eve,2024-05-25T08:14:00
755,0217c6a0,Medium,Open,Hardware,Login issue,Hardware issue: Login issue — see ticket 0217c6a0.,5/9/2024,5/11/2024,David,2024-05-09T19:25:00
756,465c6cde,Low,In Progress,Network,Email not working,Frank to resolve Email not working in Network.,9/22/2024,9/26/2024,Frank,2024-09-22T08:25:00
757,9eb6876e,Critical,Resolved,Security,VPN problem,VPN problem — Security ticket assigned to Alice.,7/1/2024,7/8/2024,Alice,2024-07-01T03:43:00
758,a68c1d1e,High,In Progress,Network,VPN problem,High - VPN problem. Assigned: Carol.,2/22/2024,3/3/2024,Carol,2024-02-22T17:03:00
759,82a5eb57,Low,Open,Security,Computer slow,Computer slow reported; Frank handling; Low.,10/6/2024,10/6/2024,Frank,2024-10-06T17:19:00
760,cb3fc7b6,Medium,Open,Software,Software install request,Software install request reported; Eve handling; Medium.,8/17/2024,,Eve,2024-08-17T22:57:00
761,f9354cf2,Medium,In Progress,Network,Software install request,Software install request — Network ticket assigned to Eve.,7/29/2024,8/7/2024,Eve,2024-07-29T00:08:00
762,ac254048,Medium,Closed,Access,VPN problem,VPN problem (Access) — ticket ac254048.,9/30/2024,10/8/2024,Grace,2024-09-30T06:44:00
763,dba8fe9d,Medium,Resolved,Hardware,Computer slow,Grace to resolve Computer slow in Hardware.,6/6/2024,6/12/2024,Grace,2024-06-06T21:43:00
764,1a3fed37,High,Resolved,Software,Software install request,Software - Software install request. Priority: High.,5/22/2024,5/24/2024,Bob,2024-05-22T06:16:00
765,2884c9fc,High,Closed,Software,Email not working,High - Email not working. Assigned: Eve.,7/1/2024,7/11/2024,Eve,2024-07-01T00:23:00
766,2b25c6eb,Medium,Open,Software,Software install request,Software install request — Software ticket assigned to Alice.,10/22/2024,,Alice,2024-10-22T08:40:00
767,ccb806b8,Critical,Resolved,Access,VPN problem,VPN problem — Access ticket assigned to Carol.,10/8/2024,10/13/2024,Carol,2024-10-08T11:08:00
768,40eac2d0,High,Closed,Hardware,VPN problem,High priority: VPN problem (Hardware).,1/4/2024,1/9/2024,David,2024-01-04T10:52:00
769,da5c89f4,Critical,Resolved,Hardware,Email not working,Email not working; Hardware; assigned Carol.,5/15/2024,5/16/2024,Carol,2024-05-15T20:26:00
770,7.66E+20,Critical,Resolved,Network,Software install request,Bob to resolve Software install request in Network.,9/30/2024,10/6/2024,Bob,2024-09-30T08:54:00
771,687d3542,Critical,In Progress,Network,VPN problem,Critical priority: VPN problem (Network).,3/8/2024,,Frank,2024-03-08T17:58:00
772,8e920ccc,Low,Resolved,Security,Computer slow,Security - Computer slow. Priority: Low.,8/16/2024,8/16/2024,Alice,2024-08-16T01:49:00
773,f6af08ef,Medium,Resolved,Software,Login issue,David to resolve Login issue in Software.,8/30/2024,,David,2024-08-30T08:20:00
774,b3a74f37,Low,Open,Hardware,Login issue,Low priority: Login issue (Hardware).,2/9/2024,2/9/2024,Frank,2024-02-09T05:24:00
775,09f6a44a,High,Closed,Security,VPN problem,High - VPN problem. Assigned: David.,5/18/2024,5/25/2024,David,2024-05-18T10:59:00
776,fcb2e5e8,Medium,Open,Network,Computer slow,Network issue: Computer slow — see ticket fcb2e5e8.,5/23/2024,5/23/2024,Frank,2024-05-23T01:06:00
777,ec5a26d5,High,In Progress,Access,Email not working,Bob to resolve Email not working in Access.,10/22/2024,,Bob,2024-10-22T15:11:00
778,26d8c29f,Low,Open,Hardware,Computer slow,Computer slow; Hardware; assigned Frank.,1/27/2024,,Frank,2024-01-27T18:37:00
779,56490ae1,Critical,Closed,Software,VPN problem,Software issue: VPN problem — see ticket 56490ae1.,7/15/2024,,Alice,2024-07-15T00:46:00
780,28b3bea5,High,Open,Software,Software install request,David to resolve Software install request in Software.,3/12/2024,3/20/2024,David,2024-03-12T11:22:00
781,2267efcd,Low,Resolved,Security,Computer slow,Help David with Computer slow (Security).,6/25/2024,6/26/2024,David,2024-06-25T23:31:00
782,17b58658,Low,In Progress,Hardware,Software install request,Frank to resolve Software install request in Hardware.,2/20/2024,2/25/2024,Frank,2024-02-20T06:34:00
783,b894fc82,Low,Closed,Hardware,Email not working,Email not working — Hardware ticket assigned to Frank.,8/24/2024,,Frank,2024-08-24T17:23:00
784,3e3216aa,Critical,Closed,Hardware,Email not working,Help Eve with Email not working (Hardware).,3/26/2024,,Eve,2024-03-26T18:39:00
785,d9be47ac,High,In Progress,Security,VPN problem,VPN problem reported; Alice handling; High.,5/1/2024,5/10/2024,Alice,2024-05-01T00:58:00
786,794fb286,Medium,In Progress,Security,Login issue,Login issue (Security) — ticket 794fb286.,6/14/2024,6/20/2024,Grace,2024-06-14T16:57:00
787,e5c18205,Critical,In Progress,Security,VPN problem,Critical priority: VPN problem (Security).,6/28/2024,7/6/2024,Frank,2024-06-28T17:15:00
788,f41054ac,High,Resolved,Security,Software install request,High priority: Software install request (Security).,1/18/2024,1/24/2024,Alice,2024-01-18T18:02:00
789,c309e8b4,High,Open,Network,VPN problem,Alice to resolve VPN problem in Network.,8/30/2024,9/9/2024,Alice,2024-08-30T03:00:00
790,dcfe1962,Medium,Open,Network,Email not working,Email not working — Network ticket assigned to Bob.,5/24/2024,6/2/2024,Bob,2024-05-24T20:55:00
791,bb5f324b,Critical,In Progress,Network,Software install request,Software install request; Network; assigned Bob.,5/6/2024,5/11/2024,Bob,2024-05-06T13:19:00
792,85a5a23f,High,Open,Security,Computer slow,Computer slow — Security ticket assigned to Frank.,5/12/2024,5/22/2024,Frank,2024-05-12T02:26:00
793,10499453,High,In Progress,Security,Email not working,Help Eve with Email not working (Security).,3/13/2024,3/19/2024,Eve,2024-03-13T18:25:00
794,2efe73db,Medium,Resolved,Network,Software install request,Software install request reported; Frank handling; Medium.,4/3/2024,4/8/2024,Frank,2024-04-03T05:01:00
795,9eb3c377,Low,Resolved,Hardware,Software install request,Low priority: Software install request (Hardware).,2/27/2024,3/1/2024,Carol,2024-02-27T09:53:00
796,56601f19,Critical,In Progress,Network,VPN problem,VPN problem reported; Grace handling; Critical.,4/1/2024,4/2/2024,Grace,2024-04-01T19:40:00
797,9b8819ce,Medium,In Progress,Security,VPN problem,Carol to resolve VPN problem in Security.,7/18/2024,7/28/2024,Carol,2024-07-18T16:36:00
798,23b3807f,Medium,In Progress,Security,VPN problem,VPN problem (Security) — ticket 23b3807f.,7/18/2024,7/27/2024,Grace,2024-07-18T15:31:00
799,3c10b413,Medium,Open,Network,VPN problem,VPN problem (Network) — ticket 3c10b413.,4/8/2024,4/15/2024,Eve,2024-04-08T03:24:00
800,ad794c65,Medium,In Progress,Access,VPN problem,Medium - VPN problem. Assigned: Carol.,2/10/2024,2/10/2024,Carol,2024-02-10T11:17:00
801,86996ca8,High,In Progress,Hardware,Login issue,Hardware issue: Login issue — see ticket 86996ca8.,6/22/2024,6/30/2024,Carol,2024-06-22T21:25:00
802,23ed8f99,Medium,In Progress,Hardware,Software install request,Software install request reported; Carol handling; Medium.,8/27/2024,9/6/2024,Carol,2024-08-27T08:27:00
803,02e87682,High,Closed,Access,Software install request,Software install request; Access; assigned David.,7/29/2024,8/1/2024,David,2024-07-29T02:41:00
804,f6ee4111,Critical,Open,Network,Email not working,Email not working reported; David handling; Critical.,4/22/2024,4/27/2024,David,2024-04-22T13:58:00
805,af560199,Medium,In Progress,Security,Computer slow,Help Carol with Computer slow (Security).,7/26/2024,,Carol,2024-07-26T09:08:00
806,0834a541,High,Closed,Hardware,Email not working,Alice to resolve Email not working in Hardware.,2/19/2024,2/25/2024,Alice,2024-02-19T08:25:00
807,27a05f54,High,Closed,Software,VPN problem,Help Grace with VPN problem (Software).,4/18/2024,,Grace,2024-04-18T18:49:00
808,f87e766e,Critical,In Progress,Hardware,Login issue,Login issue (Hardware) — ticket f87e766e.,1/3/2024,1/11/2024,Eve,2024-01-03T10:46:00
809,5e9a18ca,Critical,Open,Hardware,Computer slow,Hardware issue: Computer slow — see ticket 5e9a18ca.,9/26/2024,9/29/2024,Grace,2024-09-26T16:10:00
810,e09aca97,Medium,In Progress,Access,Computer slow,Medium - Computer slow. Assigned: Bob.,6/26/2024,7/5/2024,Bob,2024-06-26T14:01:00
811,bd7c6972,High,Closed,Hardware,VPN problem,Hardware issue: VPN problem — see ticket bd7c6972.,5/5/2024,,David,2024-05-05T20:57:00
812,a5ed6abe,High,Closed,Access,Login issue,High priority: Login issue (Access).,3/2/2024,3/6/2024,Frank,2024-03-02T12:56:00
813,f1d0ac84,Critical,Open,Network,VPN problem,Help Bob with VPN problem (Network).,5/6/2024,5/10/2024,Bob,2024-05-06T23:30:00
814,772dd0cd,High,Open,Access,Software install request,Access issue: Software install request — see ticket 772dd0cd.,4/21/2024,4/25/2024,David,2024-04-21T17:09:00
815,dfd49930,High,Closed,Hardware,Email not working,High priority: Email not working (Hardware).,9/21/2024,9/22/2024,Frank,2024-09-21T12:55:00
816,44a4abe7,Low,Closed,Security,Computer slow,Low priority: Computer slow (Security).,1/22/2024,,Frank,2024-01-22T02:52:00
817,4cd68022,Medium,In Progress,Network,Email not working,Network - Email not working. Priority: Medium.,6/27/2024,6/27/2024,David,2024-06-27T18:34:00
818,1ff645d4,Critical,In Progress,Hardware,Login issue,Critical - Login issue. Assigned: David.,3/8/2024,,David,2024-03-08T18:48:00
819,72b6ba8f,High,Closed,Access,VPN problem,High - VPN problem. Assigned: Bob.,1/7/2024,1/14/2024,Bob,2024-01-07T11:24:00
820,5a9bd0dd,Medium,In Progress,Network,Login issue,Network issue: Login issue — see ticket 5a9bd0dd.,10/12/2024,10/13/2024,Eve,2024-10-12T20:00:00
821,983e0cd6,Medium,Resolved,Access,Email not working,Access - Email not working. Priority: Medium.,4/30/2024,,David,2024-04-30T03:10:00
822,e9bc2aa2,Critical,Resolved,Security,Login issue,Help David with Login issue (Security).,8/8/2024,8/10/2024,David,2024-08-08T04:52:00
823,f6a937d8,Critical,Closed,Network,Software install request,Critical priority: Software install request (Network).,9/29/2024,10/1/2024,David,2024-09-29T23:36:00
824,14d09dc9,Low,Resolved,Software,Computer slow,Help Eve with Computer slow (Software).,4/23/2024,5/2/2024,Eve,2024-04-23T00:35:00
825,217128a3,High,Closed,Hardware,Email not working,High - Email not working. Assigned: David.,1/7/2024,1/17/2024,David,2024-01-07T17:40:00
826,ff11fcb5,High,Open,Software,Login issue,Eve to resolve Login issue in Software.,10/15/2024,10/19/2024,Eve,2024-10-15T10:11:00
827,577324c5,Critical,Resolved,Hardware,Software install request,Critical - Software install request. Assigned: Grace.,6/20/2024,6/24/2024,Grace,2024-06-20T09:44:00
828,0fa04f73,Medium,Closed,Software,VPN problem,VPN problem; Software; assigned Carol.,3/18/2024,3/28/2024,Carol,2024-03-18T21:32:00
829,649ac441,High,In Progress,Access,VPN problem,VPN problem reported; Frank handling; High.,7/24/2024,,Frank,2024-07-24T16:44:00
830,f86f8991,Critical,Resolved,Network,Login issue,Network issue: Login issue — see ticket f86f8991.,4/4/2024,4/9/2024,Bob,2024-04-04T01:46:00
831,830e6df4,Low,Closed,Software,Login issue,Software issue: Login issue — see ticket 830e6df4.,8/19/2024,8/22/2024,David,2024-08-19T16:31:00
832,00ab5b89,High,Closed,Network,Email not working,Email not working reported; Grace handling; High.,7/26/2024,7/29/2024,Grace,2024-07-26T12:38:00
833,c7a0e47b,High,In Progress,Security,Email not working,Email not working reported; Carol handling; High.,9/5/2024,9/6/2024,Carol,2024-09-05T15:57:00
834,0a31fbb3,Medium,In Progress,Hardware,Login issue,Medium - Login issue. Assigned: David.,9/18/2024,9/28/2024,David,2024-09-18T02:23:00
835,874d4754,High,In Progress,Network,Software install request,High - Software install request. Assigned: Carol.,2/29/2024,3/9/2024,Carol,2024-02-29T17:21:00
836,0852d7b9,High,Closed,Access,Email not working,Email not working — Access ticket assigned to Frank.,9/15/2024,,Frank,2024-09-15T13:04:00
837,3006c45b,Low,Open,Access,VPN problem,Access - VPN problem. Priority: Low.,7/21/2024,7/25/2024,Eve,2024-07-21T02:28:00
838,0c57854c,Low,In Progress,Access,Email not working,Carol to resolve Email not working in Access.,8/11/2024,8/22/2024,Carol,2024-08-11T06:06:00
839,f766b507,Critical,Resolved,Hardware,Login issue,Login issue reported; Eve handling; Critical.,3/10/2024,3/15/2024,Eve,2024-03-10T00:15:00
840,e55e853d,Critical,Closed,Network,VPN problem,Critical priority: VPN problem (Network).,8/19/2024,,Frank,2024-08-19T18:14:00
841,1f395586,High,In Progress,Security,Software install request,Software install request; Security; assigned David.,2/1/2024,,David,2024-02-01T14:34:00
842,1af5b250,Medium,Closed,Security,Login issue,Medium - Login issue. Assigned: Carol.,1/13/2024,1/13/2024,Carol,2024-01-13T03:41:00
843,ce48247d,Critical,In Progress,Software,Email not working,Email not working reported; Bob handling; Critical.,8/29/2024,9/7/2024,Bob,2024-08-29T21:23:00
844,771355fb,Low,Open,Network,Email not working,Low - Email not working. Assigned: Carol.,9/24/2024,9/25/2024,Carol,2024-09-24T14:35:00
845,b49b8440,Low,Closed,Access,VPN problem,Low priority: VPN problem (Access).,3/27/2024,3/31/2024,Frank,2024-03-27T13:07:00
846,200cd909,Critical,Open,Software,Software install request,Software - Software install request. Priority: Critical.,1/6/2024,,Alice,2024-01-06T00:27:00
847,2b028a3b,Critical,In Progress,Network,Login issue,Login issue; Network; assigned Frank.,10/26/2024,10/27/2024,Frank,2024-10-26T06:50:00
848,7ff35868,High,Open,Network,Computer slow,Computer slow — Network ticket assigned to Carol.,2/10/2024,2/13/2024,Carol,2024-02-10T08:30:00
849,2242c0cc,Medium,Resolved,Security,VPN problem,VPN problem reported; Grace handling; Medium.,2/11/2024,2/18/2024,Grace,2024-02-11T16:56:00
850,651c47e0,Medium,Closed,Hardware,Software install request,Medium - Software install request. Assigned: Frank.,3/30/2024,3/31/2024,Frank,2024-03-30T00:09:00
851,65f1b7d3,High,Resolved,Access,VPN problem,David to resolve VPN problem in Access.,2/18/2024,2/23/2024,David,2024-02-18T10:00:00
852,85e8d44e,Medium,Closed,Hardware,Email not working,Email not working reported; Frank handling; Medium.,6/15/2024,,Frank,2024-06-15T21:29:00
853,15a25fb1,Critical,Resolved,Access,VPN problem,Access - VPN problem. Priority: Critical.,3/24/2024,4/2/2024,Frank,2024-03-24T00:21:00
854,c84eab33,Critical,Closed,Software,Login issue,Critical - Login issue. Assigned: Eve.,3/12/2024,,Eve,2024-03-12T08:33:00
855,a527e535,Medium,Open,Hardware,Email not working,Frank to resolve Email not working in Hardware.,1/7/2024,,Frank,2024-01-07T16:36:00
856,5df828e0,High,In Progress,Software,Email not working,Email not working; Software; assigned Frank.,6/8/2024,6/15/2024,Frank,2024-06-08T03:57:00
857,174749a8,High,Closed,Security,Email not working,Email not working reported; Frank handling; High.,6/16/2024,6/26/2024,Frank,2024-06-16T22:16:00
858,6102c23e,Medium,Closed,Access,Email not working,Medium - Email not working. Assigned: Bob.,2/9/2024,,Bob,2024-02-09T22:42:00
859,a8c46d1c,Medium,Open,Access,Computer slow,Help Bob with Computer slow (Access).,4/25/2024,4/26/2024,Bob,2024-04-25T21:47:00
860,efdbbe79,Low,Open,Software,VPN problem,Software - VPN problem. Priority: Low.,5/2/2024,5/6/2024,David,2024-05-02T15:45:00
861,623eb29b,Medium,Open,Software,VPN problem,Alice to resolve VPN problem in Software.,5/19/2024,5/27/2024,Alice,2024-05-19T19:37:00
862,86cff6d1,High,Closed,Network,Computer slow,Computer slow; Network; assigned Bob.,5/14/2024,5/23/2024,Bob,2024-05-14T00:57:00
863,0ab61fab,Low,Resolved,Network,VPN problem,Network issue: VPN problem — see ticket 0ab61fab.,2/20/2024,2/25/2024,Carol,2024-02-20T03:00:00
864,8cc69d22,Medium,Resolved,Access,Login issue,Login issue — Access ticket assigned to Frank.,9/21/2024,,Frank,2024-09-21T14:07:00
865,3de23034,Low,Closed,Security,Email not working,Email not working (Security) — ticket 3de23034.,2/23/2024,2/24/2024,Frank,2024-02-23T19:43:00
866,563ab729,Critical,Closed,Software,Email not working,Help Carol with Email not working (Software).,8/19/2024,8/28/2024,Carol,2024-08-19T12:09:00
867,8c630551,Medium,Open,Security,VPN problem,Medium priority: VPN problem (Security).,2/2/2024,2/7/2024,Alice,2024-02-02T18:00:00
868,24808a56,Medium,Resolved,Software,Software install request,Carol to resolve Software install request in Software.,10/6/2024,10/11/2024,Carol,2024-10-06T09:03:00
869,57d4e044,Low,In Progress,Software,Computer slow,Software issue: Computer slow — see ticket 57d4e044.,8/19/2024,8/29/2024,Frank,2024-08-19T01:31:00
870,793aca79,Medium,Open,Network,VPN problem,Help Grace with VPN problem (Network).,10/21/2024,10/27/2024,Grace,2024-10-21T19:49:00
871,834deb20,Critical,Resolved,Network,Email not working,Network - Email not working. Priority: Critical.,3/25/2024,4/1/2024,Grace,2024-03-25T16:50:00
872,cf63e55c,Critical,Resolved,Access,Software install request,Critical - Software install request. Assigned: Eve.,4/30/2024,,Eve,2024-04-30T22:40:00
873,d5854b7d,Low,Closed,Network,VPN problem,Network - VPN problem. Priority: Low.,3/8/2024,3/15/2024,Carol,2024-03-08T09:09:00
874,8cb665d0,High,Resolved,Access,Email not working,Access issue: Email not working — see ticket 8cb665d0.,9/14/2024,,Alice,2024-09-14T05:41:00
875,6eb0663e,Critical,Open,Network,VPN problem,Network issue: VPN problem — see ticket 6eb0663e.,1/28/2024,,Bob,2024-01-28T04:04:00
876,1243e73a,Critical,Closed,Software,Email not working,Email not working reported; Carol handling; Critical.,4/19/2024,4/25/2024,Carol,2024-04-19T08:11:00
877,1af6b6ea,Low,Open,Network,Computer slow,Low - Computer slow. Assigned: Eve.,6/8/2024,6/13/2024,Eve,2024-06-08T12:16:00
878,fdcdf118,Critical,In Progress,Security,Software install request,Critical - Software install request. Assigned: Carol.,10/18/2024,10/19/2024,Carol,2024-10-18T21:31:00
879,e717a4fc,High,Open,Network,Computer slow,Computer slow (Network) — ticket e717a4fc.,6/25/2024,6/26/2024,Bob,2024-06-25T15:36:00
880,8f7f4990,Critical,Closed,Security,Computer slow,Help Grace with Computer slow (Security).,9/7/2024,9/9/2024,Grace,2024-09-07T06:42:00
881,b24c66d0,High,Resolved,Access,Computer slow,Access issue: Computer slow — see ticket b24c66d0.,6/26/2024,6/27/2024,David,2024-06-26T23:22:00
882,12dc8293,Medium,Resolved,Access,Login issue,Login issue; Access; assigned Alice.,7/27/2024,7/31/2024,Alice,2024-07-27T05:08:00
883,a6eed0c3,High,Open,Network,Login issue,Bob to resolve Login issue in Network.,7/1/2024,7/5/2024,Bob,2024-07-01T03:08:00
884,93a1bc32,Medium,Open,Security,VPN problem,VPN problem reported; Grace handling; Medium.,10/13/2024,10/19/2024,Grace,2024-10-13T14:44:00
885,c9e7a8b3,Low,Open,Security,Email not working,Low priority: Email not working (Security).,8/14/2024,8/22/2024,Alice,2024-08-14T19:24:00
886,3bcfeda4,Medium,Resolved,Security,Login issue,Login issue (Security) — ticket 3bcfeda4.,9/18/2024,,Grace,2024-09-18T06:17:00
887,d83d759f,High,Closed,Network,Login issue,Help Frank with Login issue (Network).,6/2/2024,6/7/2024,Frank,2024-06-02T13:11:00
888,18c09bdb,Low,In Progress,Hardware,VPN problem,VPN problem (Hardware) — ticket 18c09bdb.,3/30/2024,4/9/2024,Alice,2024-03-30T16:52:00
889,0a73131c,High,Resolved,Hardware,Login issue,Login issue — Hardware ticket assigned to Carol.,1/31/2024,2/2/2024,Carol,2024-01-31T01:52:00
890,57be8145,High,Closed,Access,Software install request,Software install request — Access ticket assigned to Alice.,2/8/2024,2/14/2024,Alice,2024-02-08T15:23:00
891,52268fd1,Medium,Open,Security,Email not working,Security issue: Email not working — see ticket 52268fd1.,9/21/2024,,Grace,2024-09-21T02:46:00
892,6fe47e6a,Low,Closed,Network,Email not working,Help Bob with Email not working (Network).,4/17/2024,,Bob,2024-04-17T08:00:00
893,456eee67,High,Resolved,Hardware,Login issue,Login issue (Hardware) — ticket 456eee67.,4/17/2024,4/20/2024,David,2024-04-17T19:40:00
894,5729c52c,Medium,In Progress,Access,VPN problem,Medium priority: VPN problem (Access).,2/9/2024,,Grace,2024-02-09T12:05:00
895,143b9219,Low,Closed,Security,Computer slow,Low priority: Computer slow (Security).,6/29/2024,7/6/2024,Alice,2024-06-29T12:46:00
896,d7588d65,Critical,Open,Security,Login issue,Login issue reported; David handling; Critical.,2/18/2024,,David,2024-02-18T17:03:00
897,82df6d1d,High,In Progress,Hardware,Computer slow,Eve to resolve Computer slow in Hardware.,5/19/2024,5/28/2024,Eve,2024-05-19T19:39:00
898,f8313750,Low,Closed,Software,Login issue,Help Carol with Login issue (Software).,3/17/2024,3/25/2024,Carol,2024-03-17T23:47:00
899,bfe5d576,Critical,Resolved,Software,Email not working,Critical priority: Email not working (Software).,10/16/2024,10/25/2024,Frank,2024-10-16T03:17:00
900,d1838e90,High,In Progress,Software,Login issue,Software issue: Login issue — see ticket d1838e90.,2/4/2024,,Grace,2024-02-04T17:32:00
901,b0c81e8d,High,Closed,Software,Email not working,Software - Email not working. Priority: High.,8/24/2024,9/4/2024,Alice,2024-08-24T20:40:00
902,90cb46da,Medium,Resolved,Access,VPN problem,VPN problem — Access ticket assigned to Carol.,1/29/2024,2/8/2024,Carol,2024-01-29T11:53:00
903,44bfdf6f,Low,Closed,Access,Login issue,Access issue: Login issue — see ticket 44bfdf6f.,2/1/2024,,Grace,2024-02-01T18:17:00
904,21d67e63,Low,Resolved,Software,Computer slow,Computer slow reported; Bob handling; Low.,5/9/2024,5/10/2024,Bob,2024-05-09T14:01:00
905,f55d00c3,Critical,Closed,Network,Email not working,Email not working; Network; assigned Grace.,3/28/2024,4/4/2024,Grace,2024-03-28T18:00:00
906,908dc82a,Low,In Progress,Access,Email not working,Email not working (Access) — ticket 908dc82a.,5/16/2024,5/20/2024,Grace,2024-05-16T07:22:00
907,6375d7c5,Low,Resolved,Network,Software install request,Software install request; Network; assigned Bob.,3/25/2024,3/26/2024,Bob,2024-03-25T21:22:00
908,ebf5aefb,Low,Closed,Network,VPN problem,Low priority: VPN problem (Network).,4/10/2024,,Grace,2024-04-10T15:39:00
909,aec80225,High,Open,Access,VPN problem,High priority: VPN problem (Access).,1/24/2024,2/3/2024,Alice,2024-01-24T16:40:00
910,7ff337fb,High,In Progress,Access,Computer slow,Help Grace with Computer slow (Access).,9/11/2024,9/17/2024,Grace,2024-09-11T02:37:00
911,f03002b3,Critical,Resolved,Network,Computer slow,Computer slow; Network; assigned David.,7/31/2024,8/9/2024,David,2024-07-31T08:58:00
912,6b4561ed,Low,Resolved,Security,Software install request,Help Eve with Software install request (Security).,6/23/2024,6/29/2024,Eve,2024-06-23T17:24:00
913,035fee75,Critical,Resolved,Software,VPN problem,Software - VPN problem. Priority: Critical.,4/23/2024,5/1/2024,David,2024-04-23T16:23:00
914,8fda6bec,High,In Progress,Hardware,Computer slow,High priority: Computer slow (Hardware).,8/18/2024,,Alice,2024-08-18T22:24:00
915,a92ea958,Critical,Closed,Software,Login issue,David to resolve Login issue in Software.,5/27/2024,5/31/2024,David,2024-05-27T15:25:00
916,4886511b,Medium,Closed,Software,Software install request,Software - Software install request. Priority: Medium.,4/23/2024,5/3/2024,Bob,2024-04-23T12:55:00
917,526f9996,Medium,Open,Hardware,Computer slow,Help Frank with Computer slow (Hardware).,5/26/2024,6/4/2024,Frank,2024-05-26T06:26:00
918,771e15a4,High,Resolved,Network,VPN problem,Frank to resolve VPN problem in Network.,2/2/2024,,Frank,2024-02-02T19:09:00
919,89075f04,High,Open,Security,Email not working,Email not working reported; Carol handling; High.,3/2/2024,3/6/2024,Carol,2024-03-02T11:41:00
920,f0ae33d5,Critical,Open,Hardware,VPN problem,VPN problem; Hardware; assigned David.,2/15/2024,2/24/2024,David,2024-02-15T05:31:00
921,bf170675,Medium,Open,Hardware,Software install request,Medium priority: Software install request (Hardware).,1/9/2024,1/12/2024,Bob,2024-01-09T23:43:00
922,c289ff77,Low,Closed,Access,Computer slow,Low priority: Computer slow (Access).,2/5/2024,,Grace,2024-02-05T15:20:00
923,b8e2e293,Critical,Open,Security,Software install request,Software install request; Security; assigned Eve.,1/30/2024,2/6/2024,Eve,2024-01-30T06:21:00
924,f3f95c4e,Critical,In Progress,Hardware,VPN problem,Help Frank with VPN problem (Hardware).,7/28/2024,8/4/2024,Frank,2024-07-28T14:38:00
925,f4e7ecef,Medium,Open,Software,Email not working,Email not working — Software ticket assigned to David.,8/13/2024,8/17/2024,David,2024-08-13T07:30:00
926,36eac0db,High,Closed,Security,VPN problem,VPN problem (Security) — ticket 36eac0db.,4/24/2024,5/4/2024,David,2024-04-24T21:01:00
927,030b320a,Critical,In Progress,Network,VPN problem,Network issue: VPN problem — see ticket 030b320a.,3/11/2024,3/16/2024,Eve,2024-03-11T02:29:00
928,e842c1e0,Medium,In Progress,Hardware,Computer slow,Hardware issue: Computer slow — see ticket e842c1e0.,2/26/2024,3/6/2024,Alice,2024-02-26T03:22:00
929,9e940adf,High,Open,Hardware,Software install request,Software install request (Hardware) — ticket 9e940adf.,8/9/2024,8/13/2024,Eve,2024-08-09T18:02:00
930,1f0939e0,Medium,Closed,Access,Email not working,Medium priority: Email not working (Access).,3/10/2024,3/16/2024,Eve,2024-03-10T21:19:00
931,b9d159af,Low,Open,Hardware,Email not working,Hardware - Email not working. Priority: Low.,7/9/2024,,Frank,2024-07-09T21:06:00
932,88a27749,Low,Resolved,Hardware,VPN problem,Help Alice with VPN problem (Hardware).,7/14/2024,7/20/2024,Alice,2024-07-14T03:37:00
933,77304818,High,Resolved,Hardware,Software install request,Grace to resolve Software install request in Hardware.,5/21/2024,5/22/2024,Grace,2024-05-21T00:43:00
934,1ee356a8,Low,Closed,Hardware,Software install request,Hardware - Software install request. Priority: Low.,2/14/2024,2/14/2024,David,2024-02-14T07:20:00
935,be93d0e0,Critical,In Progress,Software,Login issue,Critical - Login issue. Assigned: David.,4/24/2024,4/27/2024,David,2024-04-24T05:00:00
936,baadf580,High,Closed,Access,Email not working,Help Grace with Email not working (Access).,6/5/2024,6/8/2024,Grace,2024-06-05T01:00:00
937,a4de63f0,Low,Closed,Hardware,Email not working,Hardware issue: Email not working — see ticket a4de63f0.,9/14/2024,9/25/2024,Frank,2024-09-14T09:22:00
938,e5356483,Critical,In Progress,Access,Email not working,Help Alice with Email not working (Access).,4/11/2024,4/16/2024,Alice,2024-04-11T14:57:00
939,a2feca63,Critical,Closed,Network,Computer slow,Critical - Computer slow. Assigned: Frank.,5/19/2024,,Frank,2024-05-19T06:22:00
940,5ba2106c,Medium,In Progress,Security,Computer slow,Computer slow — Security ticket assigned to Bob.,8/5/2024,8/14/2024,Bob,2024-08-05T10:11:00
941,e2457dea,Critical,Closed,Access,Software install request,Software install request — Access ticket assigned to Carol.,6/8/2024,6/17/2024,Carol,2024-06-08T03:01:00
942,6abf7234,Medium,Resolved,Software,VPN problem,Software issue: VPN problem — see ticket 6abf7234.,1/20/2024,1/21/2024,Alice,2024-01-20T11:35:00
943,cb8a8542,Low,Open,Hardware,VPN problem,Help Alice with VPN problem (Hardware).,9/20/2024,,Alice,2024-09-20T14:56:00
944,0c2b7655,Low,In Progress,Hardware,Computer slow,Low - Computer slow. Assigned: Carol.,6/24/2024,,Carol,2024-06-24T21:21:00
945,f303ef7d,Low,In Progress,Security,Software install request,Low - Software install request. Assigned: David.,10/6/2024,10/14/2024,David,2024-10-06T08:58:00
946,0b18d7e8,Medium,In Progress,Hardware,VPN problem,Carol to resolve VPN problem in Hardware.,1/8/2024,,Carol,2024-01-08T15:57:00
947,749b4296,High,Resolved,Network,Computer slow,Computer slow — Network ticket assigned to Alice.,9/22/2024,,Alice,2024-09-22T22:05:00
948,b0b7afc7,High,In Progress,Access,Login issue,Login issue — Access ticket assigned to Grace.,7/31/2024,8/9/2024,Grace,2024-07-31T02:47:00
949,e35e6cda,Low,Open,Access,Email not working,Email not working reported; Alice handling; Low.,7/9/2024,7/10/2024,Alice,2024-07-09T05:39:00
950,7ff76417,High,Resolved,Software,Computer slow,Software issue: Computer slow — see ticket 7ff76417.,7/3/2024,7/11/2024,Frank,2024-07-03T12:17:00
951,073597c0,Critical,Open,Software,Software install request,Software install request; Software; assigned Eve.,8/27/2024,8/29/2024,Eve,2024-08-27T17:43:00
952,d1586df3,Low,Open,Network,Computer slow,Network issue: Computer slow — see ticket d1586df3.,1/11/2024,1/13/2024,Grace,2024-01-11T15:04:00
953,a88fad11,High,In Progress,Access,Software install request,Software install request — Access ticket assigned to Carol.,4/28/2024,4/28/2024,Carol,2024-04-28T16:35:00
954,b2eceb41,Medium,Closed,Software,Email not working,Software issue: Email not working — see ticket b2eceb41.,3/5/2024,3/7/2024,Frank,2024-03-05T11:57:00
955,310e0be0,Critical,In Progress,Access,Email not working,Email not working reported; Grace handling; Critical.,3/8/2024,,Grace,2024-03-08T13:02:00
956,9bedc249,Low,Closed,Hardware,VPN problem,VPN problem (Hardware) — ticket 9bedc249.,10/2/2024,,Carol,2024-10-02T05:57:00
957,dbb90a51,Medium,Closed,Software,Login issue,Help Carol with Login issue (Software).,4/8/2024,4/9/2024,Carol,2024-04-08T18:11:00
958,66ac045b,Critical,Resolved,Network,Software install request,Bob to resolve Software install request in Network.,9/24/2024,9/30/2024,Bob,2024-09-24T11:06:00
959,4bf0dcb6,Low,Resolved,Software,Email not working,Email not working — Software ticket assigned to David.,4/5/2024,4/10/2024,David,2024-04-05T17:22:00
960,57ce24e0,Critical,Closed,Software,Software install request,Critical priority: Software install request (Software).,6/29/2024,7/7/2024,Carol,2024-06-29T07:16:00
961,a5ae0c21,Critical,Closed,Hardware,Email not working,Hardware - Email not working. Priority: Critical.,8/10/2024,8/16/2024,Grace,2024-08-10T14:14:00
962,ccb94374,Medium,Resolved,Access,Software install request,Medium priority: Software install request (Access).,3/30/2024,4/2/2024,David,2024-03-30T20:46:00
963,5df5ea14,Low,Resolved,Network,Software install request,Software install request — Network ticket assigned to Carol.,4/17/2024,,Carol,2024-04-17T14:53:00
964,67d1fbd9,Critical,Open,Security,Login issue,Critical priority: Login issue (Security).,1/9/2024,1/16/2024,Eve,2024-01-09T04:38:00
965,3a284787,Medium,Closed,Network,Computer slow,Medium - Computer slow. Assigned: Carol.,7/15/2024,7/18/2024,Carol,2024-07-15T09:49:00
966,6924c4cd,Medium,Resolved,Hardware,Email not working,Email not working — Hardware ticket assigned to David.,5/18/2024,5/19/2024,David,2024-05-18T11:35:00
967,4441810e,Low,In Progress,Network,Login issue,Help David with Login issue (Network).,4/25/2024,4/30/2024,David,2024-04-25T15:45:00
968,da0792a4,High,In Progress,Security,Login issue,Frank to resolve Login issue in Security.,9/30/2024,10/1/2024,Frank,2024-09-30T03:45:00
969,74222d8c,High,Resolved,Network,VPN problem,VPN problem reported; Bob handling; High.,5/1/2024,5/5/2024,Bob,2024-05-01T01:05:00
970,71835b2b,Low,Open,Software,Login issue,Login issue (Software) — ticket 71835b2b.,9/13/2024,9/14/2024,Bob,2024-09-13T17:51:00
971,da2958b6,High,Open,Network,Email not working,High - Email not working. Assigned: Carol.,3/11/2024,,Carol,2024-03-11T03:29:00
972,8f34ae72,Low,Resolved,Software,Login issue,Low priority: Login issue (Software).,2/2/2024,,Eve,2024-02-02T18:32:00
973,a3d9a9ec,Medium,Resolved,Network,VPN problem,VPN problem; Network; assigned Frank.,8/20/2024,8/21/2024,Frank,2024-08-20T20:51:00
974,d4c348cd,Low,Open,Hardware,Computer slow,Carol to resolve Computer slow in Hardware.,1/13/2024,1/13/2024,Carol,2024-01-13T16:16:00
975,3f277251,Low,Open,Software,Software install request,Low priority: Software install request (Software).,4/22/2024,4/27/2024,Grace,2024-04-22T02:52:00
976,ad9f5c1b,Medium,Resolved,Network,Software install request,Medium priority: Software install request (Network).,10/21/2024,10/29/2024,Grace,2024-10-21T10:09:00
977,2463673a,Medium,In Progress,Security,Computer slow,Medium priority: Computer slow (Security).,5/20/2024,5/27/2024,Eve,2024-05-20T01:53:00
978,a8d805f7,Low,Open,Security,Computer slow,Computer slow (Security) — ticket a8d805f7.,2/20/2024,2/20/2024,Bob,2024-02-20T03:42:00
979,47be74fa,Critical,Open,Network,Software install request,Software install request (Network) — ticket 47be74fa.,2/14/2024,2/15/2024,David,2024-02-14T09:25:00
980,7e781082,Low,In Progress,Hardware,Login issue,Low - Login issue. Assigned: Frank.,5/14/2024,5/17/2024,Frank,2024-05-14T18:20:00
981,1e994f2b,Medium,In Progress,Security,Computer slow,Computer slow; Security; assigned Grace.,9/23/2024,10/3/2024,Grace,2024-09-23T01:38:00
982,936376a6,Critical,In Progress,Hardware,VPN problem,Help David with VPN problem (Hardware).,1/15/2024,1/25/2024,David,2024-01-15T10:04:00
983,1d59b2fb,Low,Resolved,Security,VPN problem,VPN problem; Security; assigned Carol.,9/18/2024,9/25/2024,Carol,2024-09-18T02:14:00
984,8feed2fd,Medium,In Progress,Network,Login issue,Alice to resolve Login issue in Network.,5/16/2024,,Alice,2024-05-16T08:36:00
985,a739b3f6,Medium,Resolved,Access,Software install request,Software install request; Access; assigned David.,1/2/2024,1/8/2024,David,2024-01-02T22:12:00
986,6446b138,High,In Progress,Hardware,Computer slow,Help Frank with Computer slow (Hardware).,9/26/2024,10/6/2024,Frank,2024-09-26T09:30:00
987,45b92b44,Medium,Open,Network,Login issue,Network issue: Login issue — see ticket 45b92b44.,9/15/2024,9/24/2024,Bob,2024-09-15T19:48:00
988,cfe06644,Medium,In Progress,Network,Software install request,Software install request; Network; assigned Grace.,5/15/2024,,Grace,2024-05-15T15:59:00
989,d582ea11,High,In Progress,Security,VPN problem,VPN problem reported; Eve handling; High.,7/31/2024,8/2/2024,Eve,2024-07-31T16:35:00
990,2cedd1e8,High,Closed,Software,VPN problem,VPN problem reported; David handling; High.,10/12/2024,10/22/2024,David,2024-10-12T20:02:00
991,420dcb7a,Critical,Open,Security,Login issue,Grace to resolve Login issue in Security.,6/29/2024,,Grace,2024-06-29T03:21:00
992,890d70c7,Critical,Open,Security,Login issue,Login issue reported; Carol handling; Critical.,3/10/2024,3/13/2024,Carol,2024-03-10T07:54:00
993,fa631f24,Critical,Resolved,Security,Software install request,Software install request — Security ticket assigned to David.,3/13/2024,,David,2024-03-13T06:00:00
994,4ffef384,Medium,In Progress,Software,Email not working,Medium - Email not working. Assigned: Alice.,7/9/2024,7/15/2024,Alice,2024-07-09T07:39:00
995,c3ac6aa6,Low,Resolved,Security,Software install request,Software install request reported; Frank handling; Low.,10/26/2024,10/26/2024,Frank,2024-10-26T01:42:00
996,b19a1a7a,Critical,In Progress,Software,Software install request,Critical priority: Software install request (Software).,6/2/2024,,Bob,2024-06-02T01:28:00
997,4f152c10,Low,Closed,Security,Software install request,David to resolve Software install request in Security.,5/5/2024,5/8/2024,David,2024-05-05T23:22:00
998,43b28eb1,Low,Closed,Software,VPN problem,VPN problem — Software ticket assigned to Frank.,1/6/2024,1/9/2024,Frank,2024-01-06T08:18:00
999,f1006093,Low,Open,Security,Email not working,Email not working (Security) — ticket f1006093.,8/19/2024,8/28/2024,David,2024-08-19T17:35:00
1000,3786bb5c,High,In Progress,Hardware,Email not working,Help David with Email not working (Hardware).,3/9/2024,3/18/2024,David,2024-03-09T03:20:00
